Date,Player,Active,Team,Type,date,season,player_name,nba_team,contract_type
11/05/25,"Martin, Cody",Yes,Indiana Pacers,10-day contract,2025-11-05,2025-26,"Martin, Cody",Indiana Pacers,10-day contract
11/01/25,"Robinson-Earl, Jeremiah",Yes,Indiana Pacers,Two 10-day contracts (only 1st date is shown),2025-11-01,2025-26,"Robinson-Earl, Jeremiah",Indiana Pacers,Two 10-day contracts (only 1st date is shown)
10/27/25,"Bassey, Charles",,Memphis Grizzlies,10-day contract,2025-10-27,2025-26,"Bassey, Charles",Memphis Grizzlies,10-day contract
04/13/25,"Mobley, Isaiah",,Philadelphia 76ers,10-day contract,2025-04-13,2024-25,"Mobley, Isaiah",Philadelphia 76ers,10-day contract
04/03/25,"Castleton, Colin",,Philadelphia 76ers,10-day contract,2025-04-03,2024-25,"Castleton, Colin",Philadelphia 76ers,10-day contract
04/03/25,"Sims, Jaylen",,Charlotte Hornets,Two 10-day contracts (only 1st date is shown),2025-04-03,2024-25,"Sims, Jaylen",Charlotte Hornets,Two 10-day contracts (only 1st date is shown)
04/03/25,"Kelley, Kylor",,New Orleans Pelicans,Two 10-day contracts (only 1st date is shown),2025-04-03,2024-25,"Kelley, Kylor",New Orleans Pelicans,Two 10-day contracts (only 1st date is shown)
03/26/25,"Swider, Cole",,Toronto Raptors,10-day contract followed by signing for the rest of season,2025-03-26,2024-25,"Swider, Cole",Toronto Raptors,10-day contract followed by signing for the rest of season
03/26/25,"Wheeler, Phillip",,Philadelphia 76ers,10-day contract,2025-03-26,2024-25,"Wheeler, Phillip",Philadelphia 76ers,10-day contract
03/24/25,"Bagley, Marcus",,Philadelphia 76ers,Two 10-day contracts (only 1st date is shown),2025-03-24,2024-25,"Bagley, Marcus",Philadelphia 76ers,Two 10-day contracts (only 1st date is shown)
03/21/25,"Payton, Elfrid",,New Orleans Pelicans,Two 10-day contracts followed by signing for the rest of season,2025-03-21,2024-25,"Payton, Elfrid",New Orleans Pelicans,Two 10-day contracts followed by signing for the rest of season
03/18/25,"Taylor, Terry",,Sacramento Kings,10-day contract,2025-03-18,2024-25,"Taylor, Terry",Sacramento Kings,10-day contract
03/14/25,"Brissett, Oshae",,Philadelphia 76ers,10-day contract,2025-03-14,2024-25,"Brissett, Oshae",Philadelphia 76ers,10-day contract
03/12/25,"Garrett, Marcus",,Charlotte Hornets,10-day contract,2025-03-12,2024-25,"Garrett, Marcus",Charlotte Hornets,10-day contract
03/10/25,"Bamba, Mohamed",,New Orleans Pelicans,10-day contract,2025-03-10,2024-25,"Bamba, Mohamed",New Orleans Pelicans,10-day contract
03/10/25,"Tucker, P.J.",,New York Knicks,Two 10-day contracts followed by signing for the rest of season,2025-03-10,2024-25,"Tucker, P.J.",New York Knicks,Two 10-day contracts followed by signing for the rest of season
03/06/25,"Castleton, Colin",,Toronto Raptors,Two 10-day contracts (only 1st date is shown),2025-03-06,2024-25,"Castleton, Colin",Toronto Raptors,Two 10-day contracts (only 1st date is shown)
03/03/25,"Labissiere, Skal",,Sacramento Kings,10-day contract,2025-03-03,2024-25,"Labissiere, Skal",Sacramento Kings,10-day contract
03/02/25,"Bradley, Tony",,Indiana Pacers,Two 10-day contracts followed by signing for the rest of season,2025-03-02,2024-25,"Bradley, Tony",Indiana Pacers,Two 10-day contracts followed by signing for the rest of season
03/01/25,"Flynn, Malachi",,Charlotte Hornets,10-day contract,2025-03-01,2024-25,"Flynn, Malachi",Charlotte Hornets,10-day contract
03/01/25,"Harris, Kevon",,Atlanta Hawks,10-day contract,2025-03-01,2024-25,"Harris, Kevon",Atlanta Hawks,10-day contract
02/22/25,"McDaniels, Jalen",,Washington Wizards,10-day contract,2025-02-22,2024-25,"McDaniels, Jalen",Washington Wizards,10-day contract
02/21/25,"Stevens, Lamar",,Memphis Grizzlies,Two 10-day contracts followed by signing for the rest of season,2025-02-21,2024-25,"Stevens, Lamar",Memphis Grizzlies,Two 10-day contracts followed by signing for the rest of season
02/20/25,"Springer, Jaden",,Utah Jazz,10-day contract followed by signing for the rest of season,2025-02-20,2024-25,"Springer, Jaden",Utah Jazz,10-day contract followed by signing for the rest of season
02/20/25,"Hayes, Killian",,Brooklyn Nets,10-day contract,2025-02-20,2024-25,"Hayes, Killian",Brooklyn Nets,10-day contract
02/20/25,"Brown, Moses",,Dallas Mavericks,10-day contract,2025-02-20,2024-25,"Brown, Moses",Dallas Mavericks,10-day contract
02/20/25,"Tomlin, Nae'Qwan",,Cleveland Cavaliers,10-day contract,2025-02-20,2024-25,"Tomlin, Nae'Qwan",Cleveland Cavaliers,10-day contract
02/19/25,"Collins, Yuri",,Golden State Warriors,10-day contract,2025-02-19,2024-25,"Collins, Yuri",Golden State Warriors,10-day contract
02/19/25,"Rhoden, Jared",,Toronto Raptors,10-day contract,2025-02-19,2024-25,"Rhoden, Jared",Toronto Raptors,10-day contract
02/19/25,"Knox, Kevin",,Golden State Warriors,Two 10-day contracts followed by signing for the rest of season,2025-02-19,2024-25,"Knox, Kevin",Golden State Warriors,Two 10-day contracts followed by signing for the rest of season
02/17/25,"Stevenson, Erik",,Washington Wizards,10-day contract,2025-02-17,2024-25,"Stevenson, Erik",Washington Wizards,10-day contract
02/11/25,"Roddy, David",,Philadelphia 76ers,10-day contract,2025-02-11,2024-25,"Roddy, David",Philadelphia 76ers,10-day contract
02/11/25,"Okafor, Jahlil",,Indiana Pacers,10-day contract,2025-02-11,2024-25,"Okafor, Jahlil",Indiana Pacers,10-day contract
02/09/25,"Biyombo, Bismack",,San Antonio Spurs,Two 10-day contracts followed by signing for the rest of season,2025-02-09,2024-25,"Biyombo, Bismack",San Antonio Spurs,Two 10-day contracts followed by signing for the rest of season
02/08/25,"Nix, Daishen",,Sacramento Kings,10-day contract,2025-02-08,2024-25,"Nix, Daishen",Sacramento Kings,10-day contract
02/08/25,"Nowell, Jaylen",,Washington Wizards,10-day contract,2025-02-08,2024-25,"Nowell, Jaylen",Washington Wizards,10-day contract
02/07/25,"Payton, Elfrid",,Charlotte Hornets,Two 10-day contracts (only 1st date is shown),2025-02-07,2024-25,"Payton, Elfrid",Charlotte Hornets,Two 10-day contracts (only 1st date is shown)
02/07/25,"Okeke, Chuma",,Philadelphia 76ers,Two 10-day contracts (only 1st date is shown),2025-02-07,2024-25,"Okeke, Chuma",Philadelphia 76ers,Two 10-day contracts (only 1st date is shown)
01/18/25,"Robinson, Orlando",,Toronto Raptors,Two 10-day contracts followed by signing for the rest of season,2025-01-18,2024-25,"Robinson, Orlando",Toronto Raptors,Two 10-day contracts followed by signing for the rest of season
01/10/25,"Carlson, Branden",,Oklahoma City Thunder,Two 10-day contracts (only 1st date is shown),2025-01-10,2024-25,"Carlson, Branden",Oklahoma City Thunder,Two 10-day contracts (only 1st date is shown)
01/08/25,"Omoruyi, Eugene",,Toronto Raptors,10-day contract,2025-01-08,2024-25,"Omoruyi, Eugene",Toronto Raptors,10-day contract
04/09/24,"White, Jack",,Memphis Grizzlies,10-day contract,2024-04-09,2023-24,"White, Jack",Memphis Grizzlies,10-day contract
04/06/24,"Allen, Timmy",,Memphis Grizzlies,10-day contract,2024-04-06,2023-24,"Allen, Timmy",Memphis Grizzlies,10-day contract
04/03/24,"Nowell, Jaylen",,Detroit Pistons,Two 10-day contracts (only 1st date is shown),2024-04-03,2023-24,"Nowell, Jaylen",Detroit Pistons,Two 10-day contracts (only 1st date is shown)
04/03/24,"Williams, Malik",,Toronto Raptors,10-day contract followed by signing for the rest of season,2024-04-03,2023-24,"Williams, Malik",Toronto Raptors,10-day contract followed by signing for the rest of season
03/30/24,"Simpson, Zavier",,Memphis Grizzlies,Two 10-day contracts (only 1st date is shown),2024-03-30,2023-24,"Simpson, Zavier",Memphis Grizzlies,Two 10-day contracts (only 1st date is shown)
03/24/24,"Wilson, D.J.",,Philadelphia 76ers,10-day contract,2024-03-24,2023-24,"Wilson, D.J.",Philadelphia 76ers,10-day contract
03/24/24,"Simmons, Kobi",,Toronto Raptors,10-day contract,2024-03-24,2023-24,"Simmons, Kobi",Toronto Raptors,10-day contract
03/23/24,"Green, Javonte",,Chicago Bulls,10-day contract followed by signing for the rest of season,2024-03-23,2023-24,"Green, Javonte",Chicago Bulls,10-day contract followed by signing for the rest of season
03/20/24,"Pereira, Maozinha",,Memphis Grizzlies,Two 10-day contracts (only 1st date is shown),2024-03-20,2023-24,"Pereira, Maozinha",Memphis Grizzlies,Two 10-day contracts (only 1st date is shown)
03/20/24,"Thomas, Isaiah",,Phoenix Suns,Two 10-day contracts followed by signing for the rest of season,2024-03-20,2023-24,"Thomas, Isaiah",Phoenix Suns,Two 10-day contracts followed by signing for the rest of season
03/20/24,"Metu, Chimezie",,Detroit Pistons,10-day contract followed by signing for the rest of season,2024-03-20,2023-24,"Metu, Chimezie",Detroit Pistons,10-day contract followed by signing for the rest of season
03/18/24,"Morris, Marcus",,Cleveland Cavaliers,10-day contract followed by signing for the rest of season,2024-03-18,2023-24,"Morris, Marcus",Cleveland Cavaliers,10-day contract followed by signing for the rest of season
03/15/24,"Jones, Kai",,Philadelphia 76ers,10-day contract,2024-03-15,2023-24,"Jones, Kai",Philadelphia 76ers,10-day contract
03/14/24,"Diakite, Mamadi",,New York Knicks,10-day contract followed by signing for the rest of season,2024-03-14,2023-24,"Diakite, Mamadi",New York Knicks,10-day contract followed by signing for the rest of season
03/10/24,"Jarreau, DeJon",,Memphis Grizzlies,Two 10-day contracts (only 1st date is shown),2024-03-10,2023-24,"Jarreau, DeJon",Memphis Grizzlies,Two 10-day contracts (only 1st date is shown)
03/09/24,"Kinsey, Taevion",,Utah Jazz,10-day contract,2024-03-09,2023-24,"Kinsey, Taevion",Utah Jazz,10-day contract
03/08/24,"Gabriel, Wenyen",,Memphis Grizzlies,10-day contract,2024-03-08,2023-24,"Gabriel, Wenyen",Memphis Grizzlies,10-day contract
03/06/24,"Gibson, Taj",,Detroit Pistons,10-day contract followed by signing for the rest of season,2024-03-06,2023-24,"Gibson, Taj",Detroit Pistons,10-day contract followed by signing for the rest of season
03/06/24,"Warren, T.J.",,Minnesota Timberwolves,Two 10-day contracts (only 1st date is shown),2024-03-06,2023-24,"Warren, T.J.",Minnesota Timberwolves,Two 10-day contracts (only 1st date is shown)
03/04/24,"Ramsey, Jahmi'us",,Toronto Raptors,Two 10-day contracts (only 1st date is shown),2024-03-04,2023-24,"Ramsey, Jahmi'us",Toronto Raptors,Two 10-day contracts (only 1st date is shown)
03/03/24,"Hampton, R.J.",,Washington Wizards,10-day contract,2024-03-03,2023-24,"Hampton, R.J.",Washington Wizards,10-day contract
03/03/24,"Brockington, Izaiah",,New Orleans Pelicans,10-day contract,2024-03-03,2023-24,"Brockington, Izaiah",New Orleans Pelicans,10-day contract
02/26/24,"Cooper, Sharife",,Cleveland Cavaliers,10-day contract,2024-02-26,2023-24,"Cooper, Sharife",Cleveland Cavaliers,10-day contract
02/22/24,"Champagnie, Justin",,Washington Wizards,10-day contract,2024-02-22,2023-24,"Champagnie, Justin",Washington Wizards,10-day contract
02/22/24,"Crutcher, Jalen",,New Orleans Pelicans,10-day contract,2024-02-22,2023-24,"Crutcher, Jalen",New Orleans Pelicans,10-day contract
02/22/24,"Jackson, Justin",,Minnesota Timberwolves,10-day contract,2024-02-22,2023-24,"Jackson, Justin",Minnesota Timberwolves,10-day contract
02/22/24,"Jeffries, DaQuan",,New York Knicks,Two 10-day contracts followed by signing for the rest of season,2024-02-22,2023-24,"Jeffries, DaQuan",New York Knicks,Two 10-day contracts followed by signing for the rest of season
02/21/24,"Carton, D.J.",,Toronto Raptors,10-day contract,2024-02-21,2023-24,"Carton, D.J.",Toronto Raptors,10-day contract
02/21/24,"Toppin, Jacob",,New York Knicks,10-day contract,2024-02-21,2023-24,"Toppin, Jacob",New York Knicks,10-day contract
02/20/24,"Bazley, Darius",,Philadelphia 76ers,10-day contract,2024-02-20,2023-24,"Bazley, Darius",Philadelphia 76ers,10-day contract
02/20/24,"Bolden, Marques",,Charlotte Hornets,10-day contract,2024-02-20,2023-24,"Bolden, Marques",Charlotte Hornets,10-day contract
02/13/24,"Goodwin, Jordan",,Memphis Grizzlies,10-day contract,2024-02-13,2023-24,"Goodwin, Jordan",Memphis Grizzlies,10-day contract
02/12/24,"Evbuomwan, Tosan",,Detroit Pistons,10-day contract,2024-02-12,2023-24,"Evbuomwan, Tosan",Detroit Pistons,10-day contract
02/11/24,"Smith, Zhaire",,Cleveland Cavaliers,10-day contract,2024-02-11,2023-24,"Smith, Zhaire",Cleveland Cavaliers,10-day contract
02/10/24,"Gueye, Mouhamadou",,Toronto Raptors,10-day contract,2024-02-10,2023-24,"Gueye, Mouhamadou",Toronto Raptors,10-day contract
02/10/24,"Winslow, Justise",,Toronto Raptors,10-day contract,2024-02-10,2023-24,"Winslow, Justise",Toronto Raptors,10-day contract
02/08/24,"Hagans, Ashton",,Portland Trail Blazers,10-day contract,2024-02-08,2023-24,"Hagans, Ashton",Portland Trail Blazers,10-day contract
01/30/24,"Evbuomwan, Tosan",,Memphis Grizzlies,10-day contract,2024-01-30,2023-24,"Evbuomwan, Tosan",Memphis Grizzlies,10-day contract
01/30/24,"Jemison, Trey",,Memphis Grizzlies,10-day contract,2024-01-30,2023-24,"Jemison, Trey",Memphis Grizzlies,10-day contract
01/30/24,"Gibson, Taj",,New York Knicks,Two 10-day contracts (only 1st date is shown),2024-01-30,2023-24,"Gibson, Taj",New York Knicks,Two 10-day contracts (only 1st date is shown)
01/29/24,"Hurt, Matthew",,Memphis Grizzlies,Two 10-day contracts (only 1st date is shown),2024-01-29,2023-24,"Hurt, Matthew",Memphis Grizzlies,Two 10-day contracts (only 1st date is shown)
01/27/24,"Hill, Malcolm",,New Orleans Pelicans,10-day contract,2024-01-27,2023-24,"Hill, Malcolm",New Orleans Pelicans,10-day contract
01/20/24,"Jemison, Trey",,Washington Wizards,10-day contract,2024-01-20,2023-24,"Jemison, Trey",Washington Wizards,10-day contract
01/20/24,"Moore, Taze",,Portland Trail Blazers,Two 10-day contracts (only 1st date is shown),2024-01-20,2023-24,"Moore, Taze",Portland Trail Blazers,Two 10-day contracts (only 1st date is shown)
01/19/24,"Johnson, James",,Indiana Pacers,Two 10-day contracts followed by signing for the rest of season,2024-01-19,2023-24,"Johnson, James",Indiana Pacers,Two 10-day contracts followed by signing for the rest of season
01/18/24,"Nance, Pete",,Cleveland Cavaliers,10-day contract,2024-01-18,2023-24,"Nance, Pete",Cleveland Cavaliers,10-day contract
01/09/24,"Toscano-Anderson, Juan",,Sacramento Kings,10-day contract,2024-01-09,2023-24,"Toscano-Anderson, Juan",Sacramento Kings,10-day contract
01/09/24,"Diallo, Hamidou",,Washington Wizards,10-day contract,2024-01-09,2023-24,"Diallo, Hamidou",Washington Wizards,10-day contract
11/24/23,"Nowell, Jaylen",,Memphis Grizzlies,Two 10-day contracts (only 1st date is shown),2023-11-24,2023-24,"Nowell, Jaylen",Memphis Grizzlies,Two 10-day contracts (only 1st date is shown)
11/24/23,"Harrison, Shaquille",,Memphis Grizzlies,10-day contract,2023-11-24,2023-24,"Harrison, Shaquille",Memphis Grizzlies,10-day contract
04/09/23,"Comanche, Chance",,Portland Trail Blazers,10-day contract,2023-04-09,2022-23,"Comanche, Chance",Portland Trail Blazers,10-day contract
04/04/23,"Minaya, Justin",,Portland Trail Blazers,10-day contract,2023-04-04,2022-23,"Minaya, Justin",Portland Trail Blazers,10-day contract
03/30/23,"Mays, Skylar",,Portland Trail Blazers,Two 10-day contracts (only 1st date is shown),2023-03-30,2022-23,"Mays, Skylar",Portland Trail Blazers,Two 10-day contracts (only 1st date is shown)
03/30/23,"Harrison, Shaquille",,Portland Trail Blazers,10-day contract,2023-03-30,2022-23,"Harrison, Shaquille",Portland Trail Blazers,10-day contract
03/28/23,"Sneed, Xavier",,Charlotte Hornets,10-day contract,2023-03-28,2022-23,"Sneed, Xavier",Charlotte Hornets,10-day contract
03/28/23,"Samanic, Luka",,Utah Jazz,10-day contract followed by signing for the rest of season,2023-03-28,2022-23,"Samanic, Luka",Utah Jazz,10-day contract followed by signing for the rest of season
03/18/23,"Brantley, Jarrell",,Utah Jazz,10-day contract,2023-03-18,2022-23,"Brantley, Jarrell",Utah Jazz,10-day contract
03/17/23,"Brown, Moses",,Brooklyn Nets,Two 10-day contracts (only 1st date is shown),2023-03-17,2022-23,"Brown, Moses",Brooklyn Nets,Two 10-day contracts (only 1st date is shown)
03/06/23,"Noel, Nerlens",,Brooklyn Nets,10-day contract,2023-03-06,2022-23,"Noel, Nerlens",Brooklyn Nets,10-day contract
03/05/23,"Jeffries, DaQuan",,New York Knicks,Two 10-day contracts followed by signing for the rest of season,2023-03-05,2022-23,"Jeffries, DaQuan",New York Knicks,Two 10-day contracts followed by signing for the rest of season
03/03/23,"Omoruyi, Eugene",,Detroit Pistons,Two 10-day contracts followed by signing for the rest of season,2023-03-03,2022-23,"Omoruyi, Eugene",Detroit Pistons,Two 10-day contracts followed by signing for the rest of season
03/03/23,"Merrill, Sam",,Cleveland Cavaliers,10-day contract followed by signing for the rest of season,2023-03-03,2022-23,"Merrill, Sam",Cleveland Cavaliers,10-day contract followed by signing for the rest of season
03/03/23,"Bouyea, Jamaree",,Washington Wizards,10-day contract,2023-03-03,2022-23,"Bouyea, Jamaree",Washington Wizards,10-day contract
03/02/23,"Quinones, Lester",,Golden State Warriors,10-day contract,2023-03-02,2022-23,"Quinones, Lester",Golden State Warriors,10-day contract
02/27/23,"Cauley-Stein, Willie",,Houston Rockets,10-day contract,2023-02-27,2022-23,"Cauley-Stein, Willie",Houston Rockets,10-day contract
02/23/23,"Keels, Trevor",,New York Knicks,10-day contract,2023-02-23,2022-23,"Keels, Trevor",New York Knicks,10-day contract
02/22/23,"Leonard, Meyers",,Milwaukee Bucks,Two 10-day contracts followed by signing for the rest of season,2023-02-22,2022-23,"Leonard, Meyers",Milwaukee Bucks,Two 10-day contracts followed by signing for the rest of season
02/22/23,"Dunn, Kris",,Utah Jazz,Two 10-day contracts followed by signing for the rest of season,2023-02-22,2022-23,"Dunn, Kris",Utah Jazz,Two 10-day contracts followed by signing for the rest of season
02/22/23,"Jackson, Frank",,Utah Jazz,10-day contract,2023-02-22,2022-23,"Jackson, Frank",Utah Jazz,10-day contract
02/10/23,"Umude, Stanley",,Detroit Pistons,10-day contract,2023-02-10,2022-23,"Umude, Stanley",Detroit Pistons,10-day contract
02/08/23,"Bouyea, Jamaree",,Miami Heat,10-day contract,2023-02-08,2022-23,"Bouyea, Jamaree",Miami Heat,10-day contract
01/31/23,"Silva, Chris",,Dallas Mavericks,Two 10-day contracts (only 1st date is shown),2023-01-31,2022-23,"Silva, Chris",Dallas Mavericks,Two 10-day contracts (only 1st date is shown)
01/30/23,"Burton, Deonte",,Sacramento Kings,10-day contract,2023-01-30,2022-23,"Burton, Deonte",Sacramento Kings,10-day contract
01/11/23,"Favors, Derrick",,Atlanta Hawks,10-day contract,2023-01-11,2022-23,"Favors, Derrick",Atlanta Hawks,10-day contract
01/11/23,"Lee, Saben",,Phoenix Suns,Two 10-day contracts (only 1st date is shown),2023-01-11,2022-23,"Lee, Saben",Phoenix Suns,Two 10-day contracts (only 1st date is shown)
01/09/23,"Dozier, P.J.",,Sacramento Kings,Two 10-day contracts followed by signing for the rest of season,2023-01-09,2022-23,"Dozier, P.J.",Sacramento Kings,Two 10-day contracts followed by signing for the rest of season
01/08/23,"Dieng, Gorgui",,San Antonio Spurs,Two 10-day contracts followed by signing for the rest of season,2023-01-08,2022-23,"Dieng, Gorgui",San Antonio Spurs,Two 10-day contracts followed by signing for the rest of season
01/07/23,"Wieskamp, Joe",,Toronto Raptors,Two 10-day contracts followed by signing for the rest of season,2023-01-07,2022-23,"Wieskamp, Joe",Toronto Raptors,Two 10-day contracts followed by signing for the rest of season
01/06/23,"Brown, Sterling",,Los Angeles Lakers,10-day contract,2023-01-06,2022-23,"Brown, Sterling",Los Angeles Lakers,10-day contract
04/04/22,"Kalaitzakis, Georgios",,Oklahoma City Thunder,10-day contract,2022-04-04,2021-22,"Kalaitzakis, Georgios",Oklahoma City Thunder,10-day contract
04/04/22,"Simpson, Zavier",,Oklahoma City Thunder,10-day contract,2022-04-04,2021-22,"Simpson, Zavier",Oklahoma City Thunder,10-day contract
03/31/22,"Cannady, Devin",,Orlando Magic,10-day contract followed by signing for the rest of season,2022-03-31,2021-22,"Cannady, Devin",Orlando Magic,10-day contract followed by signing for the rest of season
03/28/22,"Monroe, Greg",,Utah Jazz,10-day contract,2022-03-28,2021-22,"Monroe, Greg",Utah Jazz,10-day contract
03/28/22,"Morgan, Juwan",,Boston Celtics,10-day contract followed by signing for the rest of season,2022-03-28,2021-22,"Morgan, Juwan",Boston Celtics,10-day contract followed by signing for the rest of season
03/24/22,"Key, Braxton",,Detroit Pistons,10-day contract,2022-03-24,2021-22,"Key, Braxton",Detroit Pistons,10-day contract
03/22/22,"Dowtin, Jeff",,Orlando Magic,10-day contract,2022-03-22,2021-22,"Dowtin, Jeff",Orlando Magic,10-day contract
03/14/22,"Dunn, Kris",,Portland Trail Blazers,Three or more 10-day contracts (only 1st date is shown),2022-03-14,2021-22,"Dunn, Kris",Portland Trail Blazers,Three or more 10-day contracts (only 1st date is shown)
03/11/22,"Wallace, Tyrone",,New Orleans Pelicans,Two 10-day contracts (only 1st date is shown),2022-03-11,2021-22,"Wallace, Tyrone",New Orleans Pelicans,Two 10-day contracts (only 1st date is shown)
03/10/22,"Brown, Moses",,Cleveland Cavaliers,Two 10-day contracts (only 1st date is shown),2022-03-10,2021-22,"Brown, Moses",Cleveland Cavaliers,Two 10-day contracts (only 1st date is shown)
03/06/22,"Brooks, Armoni",,Toronto Raptors,Two 10-day contracts followed by signing for the rest of season,2022-03-06,2021-22,"Brooks, Armoni",Toronto Raptors,Two 10-day contracts followed by signing for the rest of season
03/02/22,"Thomas, Isaiah",,Charlotte Hornets,Two 10-day contracts followed by signing for the rest of season,2022-03-02,2021-22,"Thomas, Isaiah",Charlotte Hornets,Two 10-day contracts followed by signing for the rest of season
03/02/22,"Johnson, Alize",,New Orleans Pelicans,Two 10-day contracts (only 1st date is shown),2022-03-02,2021-22,"Johnson, Alize",New Orleans Pelicans,Two 10-day contracts (only 1st date is shown)
02/26/22,"Frazier, Tim",,Cleveland Cavaliers,10-day contract,2022-02-26,2021-22,"Frazier, Tim",Cleveland Cavaliers,10-day contract
02/24/22,"Cauley-Stein, Willie",,Philadelphia 76ers,10-day contract,2022-02-24,2021-22,"Cauley-Stein, Willie",Philadelphia 76ers,10-day contract
02/23/22,"Martin, Kelan",,Boston Celtics,Two 10-day contracts (only 1st date is shown),2022-02-23,2021-22,"Martin, Kelan",Boston Celtics,Two 10-day contracts (only 1st date is shown)
02/23/22,"Fitts, Malik",,Boston Celtics,Two 10-day contracts followed by signing for the rest of season,2022-02-23,2021-22,"Fitts, Malik",Boston Celtics,Two 10-day contracts followed by signing for the rest of season
02/22/22,"Eubanks, Drew",,Portland Trail Blazers,Three or more 10-day contracts (only 1st date is shown),2022-02-22,2021-22,"Eubanks, Drew",Portland Trail Blazers,Three or more 10-day contracts (only 1st date is shown)
02/05/22,"Monroe, Greg",,Milwaukee Bucks,10-day contract,2022-02-05,2021-22,"Monroe, Greg",Milwaukee Bucks,10-day contract
02/04/22,"Perry, Reggie",,Indiana Pacers,10-day contract,2022-02-04,2021-22,"Perry, Reggie",Indiana Pacers,10-day contract
02/04/22,"Cheatham, Zylan",,New Orleans Pelicans,10-day contract,2022-02-04,2021-22,"Cheatham, Zylan",New Orleans Pelicans,10-day contract
02/04/22,"Oni, Miye",,New Orleans Pelicans,10-day contract,2022-02-04,2021-22,"Oni, Miye",New Orleans Pelicans,10-day contract
01/28/22,"Gabriel, Wenyen",,New Orleans Pelicans,10-day contract,2022-01-28,2021-22,"Gabriel, Wenyen",New Orleans Pelicans,10-day contract
01/21/22,"Cousins, DeMarcus",,Denver Nuggets,Three or more 10-day contracts followed by signing for the rest of season,2022-01-21,2021-22,"Cousins, DeMarcus",Denver Nuggets,Three or more 10-day contracts followed by signing for the rest of season
01/19/22,"Harrison, Shaquille",,Memphis Grizzlies,10-day contract,2022-01-19,2021-22,"Harrison, Shaquille",Memphis Grizzlies,10-day contract
01/14/22,"Hill, Malcolm",,Chicago Bulls,10-day contract,2022-01-14,2021-22,"Hill, Malcolm",Chicago Bulls,10-day contract
01/12/22,"Cheatham, Zylan",,Utah Jazz,10-day contract,2022-01-12,2021-22,"Cheatham, Zylan",Utah Jazz,10-day contract
01/11/22,"Diakite, Mamadi",,Oklahoma City Thunder,Three or more 10-day contracts (only 1st date is shown),2022-01-11,2021-22,"Diakite, Mamadi",Oklahoma City Thunder,Three or more 10-day contracts (only 1st date is shown)
01/10/22,"Ennis, James",,Denver Nuggets,10-day contract,2022-01-10,2021-22,"Ennis, James",Denver Nuggets,10-day contract
01/10/22,"Valentine, Denzel",,Utah Jazz,10-day contract,2022-01-10,2021-22,"Valentine, Denzel",Utah Jazz,10-day contract
01/07/22,"Dowtin, Jeff",,Milwaukee Bucks,10-day contract,2022-01-07,2021-22,"Dowtin, Jeff",Milwaukee Bucks,10-day contract
01/07/22,"Pelle, Norvel",,Utah Jazz,10-day contract,2022-01-07,2021-22,"Pelle, Norvel",Utah Jazz,10-day contract
01/07/22,"Galloway, Langston",,Milwaukee Bucks,10-day contract,2022-01-07,2021-22,"Galloway, Langston",Milwaukee Bucks,10-day contract
01/06/22,"Monroe, Greg",,Washington Wizards,10-day contract,2022-01-06,2021-22,"Monroe, Greg",Washington Wizards,10-day contract
01/06/22,"House, Danuel",,Utah Jazz,Three or more 10-day contracts followed by signing for the rest of season,2022-01-06,2021-22,"House, Danuel",Utah Jazz,Three or more 10-day contracts followed by signing for the rest of season
01/06/22,"Johnson, Tyler",,San Antonio Spurs,10-day contract,2022-01-06,2021-22,"Johnson, Tyler",San Antonio Spurs,10-day contract
01/06/22,"Lamb, Anthony",,San Antonio Spurs,10-day contract,2022-01-06,2021-22,"Lamb, Anthony",San Antonio Spurs,10-day contract
01/06/22,"Arcidiacono, Ryan",,New York Knicks,Two 10-day contracts (only 1st date is shown),2022-01-06,2021-22,"Arcidiacono, Ryan",New York Knicks,Two 10-day contracts (only 1st date is shown)
01/05/22,"Key, Braxton",,Philadelphia 76ers,10-day contract,2022-01-05,2021-22,"Key, Braxton",Philadelphia 76ers,10-day contract
01/04/22,"Jackson, Justin",,Phoenix Suns,Two 10-day contracts (only 1st date is shown),2022-01-04,2021-22,"Jackson, Justin",Phoenix Suns,Two 10-day contracts (only 1st date is shown)
01/03/22,"Brown, Charlie",,Philadelphia 76ers,10-day contract,2022-01-03,2021-22,"Brown, Charlie",Philadelphia 76ers,10-day contract
01/03/22,"Teske, Jon",,Memphis Grizzlies,10-day contract,2022-01-03,2021-22,"Teske, Jon",Memphis Grizzlies,10-day contract
01/03/22,"Kornet, Luke",,Milwaukee Bucks,10-day contract,2022-01-03,2021-22,"Kornet, Luke",Milwaukee Bucks,10-day contract
01/01/22,"Morris, Jaylen",,San Antonio Spurs,10-day contract,2022-01-01,2021-22,"Morris, Jaylen",San Antonio Spurs,10-day contract
01/01/22,"Jones, Carlik",,Denver Nuggets,10-day contract,2022-01-01,2021-22,"Jones, Carlik",Denver Nuggets,10-day contract
01/01/22,"Waters, Tremont",,Washington Wizards,10-day contract,2022-01-01,2021-22,"Waters, Tremont",Washington Wizards,10-day contract
01/01/22,"Biyombo, Bismack",,Phoenix Suns,10-day contract,2022-01-01,2021-22,"Biyombo, Bismack",Phoenix Suns,10-day contract
01/01/22,"Anderson, Justin",,Indiana Pacers,Three or more 10-day contracts (only 1st date is shown),2022-01-01,2021-22,"Anderson, Justin",Indiana Pacers,Three or more 10-day contracts (only 1st date is shown)
01/01/22,"Stephenson, Lance",,Indiana Pacers,Three or more 10-day contracts followed by signing for the rest of season,2022-01-01,2021-22,"Stephenson, Lance",Indiana Pacers,Three or more 10-day contracts followed by signing for the rest of season
01/01/22,"Jeffries, DaQuan",,Memphis Grizzlies,10-day contract,2022-01-01,2021-22,"Jeffries, DaQuan",Memphis Grizzlies,10-day contract
12/31/21,"Paige, Jaysean",,Detroit Pistons,10-day contract,2021-12-31,2021-22,"Paige, Jaysean",Detroit Pistons,10-day contract
12/31/21,"Tucker, Rayjon",,Denver Nuggets,10-day contract,2021-12-31,2021-22,"Tucker, Rayjon",Denver Nuggets,10-day contract
12/31/21,"Caver, Ahmad",,Indiana Pacers,10-day contract,2021-12-31,2021-22,"Caver, Ahmad",Indiana Pacers,10-day contract
12/31/21,"Gabriel, Wenyen",,Los Angeles Clippers,Two 10-day contracts (only 1st date is shown),2021-12-31,2021-22,"Gabriel, Wenyen",Los Angeles Clippers,Two 10-day contracts (only 1st date is shown)
12/31/21,"Silva, Chris",,Miami Heat,Three or more 10-day contracts (only 1st date is shown),2021-12-31,2021-22,"Silva, Chris",Miami Heat,Three or more 10-day contracts (only 1st date is shown)
12/31/21,"Stauskas, Nik",,Miami Heat,10-day contract,2021-12-31,2021-22,"Stauskas, Nik",Miami Heat,10-day contract
12/31/21,"Goodwin, Brandon",,Cleveland Cavaliers,10-day contract,2021-12-31,2021-22,"Goodwin, Brandon",Cleveland Cavaliers,10-day contract
12/31/21,"Bass, Paris",,Phoenix Suns,Two 10-day contracts (only 1st date is shown),2021-12-31,2021-22,"Bass, Paris",Phoenix Suns,Two 10-day contracts (only 1st date is shown)
12/31/21,"Chalmers, Mario",,Miami Heat,10-day contract,2021-12-31,2021-22,"Chalmers, Mario",Miami Heat,10-day contract
12/30/21,"Highsmith, Haywood",,Miami Heat,Three or more 10-day contracts followed by signing for the rest of season,2021-12-30,2021-22,"Highsmith, Haywood",Miami Heat,Three or more 10-day contracts followed by signing for the rest of season
12/30/21,"Walker, M.J.",,Phoenix Suns,10-day contract,2021-12-30,2021-22,"Walker, M.J.",Phoenix Suns,10-day contract
12/30/21,"Bell, Jordan",,Chicago Bulls,10-day contract,2021-12-30,2021-22,"Bell, Jordan",Chicago Bulls,10-day contract
12/30/21,"Echenique, Jaime",,Washington Wizards,10-day contract,2021-12-30,2021-22,"Echenique, Jaime",Washington Wizards,10-day contract
12/30/21,"Hinton, Nate",,Indiana Pacers,10-day contract,2021-12-30,2021-22,"Hinton, Nate",Indiana Pacers,10-day contract
12/30/21,"Holman, Aric",,Miami Heat,10-day contract,2021-12-30,2021-22,"Holman, Aric",Miami Heat,10-day contract
12/30/21,"Guy, Kyle",,Miami Heat,Two 10-day contracts (only 1st date is shown),2021-12-30,2021-22,"Guy, Kyle",Miami Heat,Two 10-day contracts (only 1st date is shown)
12/30/21,"Mathias, Dakota",,Memphis Grizzlies,Two 10-day contracts (only 1st date is shown),2021-12-30,2021-22,"Mathias, Dakota",Memphis Grizzlies,Two 10-day contracts (only 1st date is shown)
12/29/21,"Clemons, Chris",,Atlanta Hawks,10-day contract,2021-12-29,2021-22,"Clemons, Chris",Atlanta Hawks,10-day contract
12/29/21,"Oliver, Cameron",,Atlanta Hawks,10-day contract,2021-12-29,2021-22,"Oliver, Cameron",Atlanta Hawks,10-day contract
12/29/21,"Newman, Malik",,Cleveland Cavaliers,10-day contract,2021-12-29,2021-22,"Newman, Malik",Cleveland Cavaliers,10-day contract
12/29/21,"Ennis, James",,Los Angeles Clippers,10-day contract,2021-12-29,2021-22,"Ennis, James",Los Angeles Clippers,10-day contract
12/29/21,"Hoard, Jaylen",,Oklahoma City Thunder,Two 10-day contracts (only 1st date is shown),2021-12-29,2021-22,"Hoard, Jaylen",Oklahoma City Thunder,Two 10-day contracts (only 1st date is shown)
12/29/21,"Potter, Micah",,Detroit Pistons,10-day contract,2021-12-29,2021-22,"Potter, Micah",Detroit Pistons,10-day contract
12/29/21,"Wanamaker, Brad",,Washington Wizards,10-day contract,2021-12-29,2021-22,"Wanamaker, Brad",Washington Wizards,10-day contract
12/29/21,"Thomas, Isaiah",,Dallas Mavericks,10-day contract,2021-12-29,2021-22,"Thomas, Isaiah",Dallas Mavericks,10-day contract
12/28/21,"Palmer, Trayvon",,Detroit Pistons,10-day contract,2021-12-28,2021-22,"Palmer, Trayvon",Detroit Pistons,10-day contract
12/28/21,"Jarreau, DeJon",,Houston Rockets,10-day contract,2021-12-28,2021-22,"Jarreau, DeJon",Houston Rockets,10-day contract
12/28/21,"Hunt, Feron",,New Orleans Pelicans,10-day contract,2021-12-28,2021-22,"Hunt, Feron",New Orleans Pelicans,10-day contract
12/28/21,"Johnson, Alize",,Washington Wizards,10-day contract,2021-12-28,2021-22,"Johnson, Alize",Washington Wizards,10-day contract
12/28/21,"Robinson, Justin",,Detroit Pistons,10-day contract,2021-12-28,2021-22,"Robinson, Justin",Detroit Pistons,10-day contract
12/28/21,"Sword, Craig",,Washington Wizards,10-day contract,2021-12-28,2021-22,"Sword, Craig",Washington Wizards,10-day contract
12/28/21,"Tillman, Justin",,Atlanta Hawks,10-day contract,2021-12-28,2021-22,"Tillman, Justin",Atlanta Hawks,10-day contract
12/28/21,"Perry, Reggie",,Portland Trail Blazers,Three or more 10-day contracts (only 1st date is shown),2021-12-28,2021-22,"Perry, Reggie",Portland Trail Blazers,Three or more 10-day contracts (only 1st date is shown)
12/27/21,"Brown, Chaundee",,Atlanta Hawks,10-day contract,2021-12-27,2021-22,"Brown, Chaundee",Atlanta Hawks,10-day contract
12/27/21,"Goodwin, Jordan",,Washington Wizards,10-day contract,2021-12-27,2021-22,"Goodwin, Jordan",Washington Wizards,10-day contract
12/27/21,"Monroe, Greg",,Minnesota Timberwolves,10-day contract,2021-12-27,2021-22,"Monroe, Greg",Minnesota Timberwolves,10-day contract
12/27/21,"Terry, Emanuel",,Phoenix Suns,10-day contract,2021-12-27,2021-22,"Terry, Emanuel",Phoenix Suns,10-day contract
12/27/21,"Edwards, Rob",,Oklahoma City Thunder,10-day contract,2021-12-27,2021-22,"Edwards, Rob",Oklahoma City Thunder,10-day contract
12/27/21,"Hopson, Scotty",,Oklahoma City Thunder,10-day contract,2021-12-27,2021-22,"Hopson, Scotty",Oklahoma City Thunder,10-day contract
12/27/21,"Sarr, Olivier",,Oklahoma City Thunder,Two 10-day contracts (only 1st date is shown),2021-12-27,2021-22,"Sarr, Olivier",Oklahoma City Thunder,Two 10-day contracts (only 1st date is shown)
12/27/21,"Sneed, Xavier",,Memphis Grizzlies,10-day contract,2021-12-27,2021-22,"Sneed, Xavier",Memphis Grizzlies,10-day contract
12/26/21,"McGriff, Cameron",,Portland Trail Blazers,10-day contract,2021-12-26,2021-22,"McGriff, Cameron",Portland Trail Blazers,10-day contract
12/26/21,"Williams, Brandon",,Portland Trail Blazers,10-day contract,2021-12-26,2021-22,"Williams, Brandon",Portland Trail Blazers,10-day contract
12/26/21,"Cumberland, Jarron",,Portland Trail Blazers,10-day contract,2021-12-26,2021-22,"Cumberland, Jarron",Portland Trail Blazers,10-day contract
12/26/21,"James, Justin",,New Orleans Pelicans,10-day contract,2021-12-26,2021-22,"James, Justin",New Orleans Pelicans,10-day contract
12/26/21,"Sirvydis, Deividas",,Detroit Pistons,10-day contract,2021-12-26,2021-22,"Sirvydis, Deividas",Detroit Pistons,10-day contract
12/26/21,"Tolliver, Anthony",,New Orleans Pelicans,10-day contract,2021-12-26,2021-22,"Tolliver, Anthony",New Orleans Pelicans,10-day contract
12/25/21,"Walton, Derrick",,Detroit Pistons,10-day contract,2021-12-25,2021-22,"Walton, Derrick",Detroit Pistons,10-day contract
12/25/21,"Buchanan, Shaq",,Memphis Grizzlies,10-day contract,2021-12-25,2021-22,"Buchanan, Shaq",Memphis Grizzlies,10-day contract
12/25/21,"Terry, Tyrell",,Memphis Grizzlies,10-day contract followed by signing for the rest of season,2021-12-25,2021-22,"Terry, Tyrell",Memphis Grizzlies,10-day contract followed by signing for the rest of season
12/25/21,"Moon, Xavier",,Los Angeles Clippers,Three or more 10-day contracts (only 1st date is shown),2021-12-25,2021-22,"Moon, Xavier",Los Angeles Clippers,Three or more 10-day contracts (only 1st date is shown)
12/25/21,"Barber, Cat",,Atlanta Hawks,10-day contract,2021-12-25,2021-22,"Barber, Cat",Atlanta Hawks,10-day contract
12/25/21,"Stanley, Cassius",,Detroit Pistons,Three or more 10-day contracts (only 1st date is shown),2021-12-25,2021-22,"Stanley, Cassius",Detroit Pistons,Three or more 10-day contracts (only 1st date is shown)
12/25/21,"Pelle, Norvel",,Boston Celtics,10-day contract,2021-12-25,2021-22,"Pelle, Norvel",Boston Celtics,10-day contract
12/25/21,"Aminu, Al-Farouq",,Boston Celtics,10-day contract,2021-12-25,2021-22,"Aminu, Al-Farouq",Boston Celtics,10-day contract
12/25/21,"Ellison, Malik",,Atlanta Hawks,10-day contract,2021-12-25,2021-22,"Ellison, Malik",Atlanta Hawks,10-day contract
12/24/21,"Collison, Darren",,Los Angeles Lakers,10-day contract,2021-12-24,2021-22,"Collison, Darren",Los Angeles Lakers,10-day contract
12/24/21,"Johnson, Stanley",,Los Angeles Lakers,Three or more 10-day contracts followed by signing for the rest of season,2021-12-24,2021-22,"Johnson, Stanley",Los Angeles Lakers,Three or more 10-day contracts followed by signing for the rest of season
12/24/21,"Oturu, Daniel",,Toronto Raptors,10-day contract,2021-12-24,2021-22,"Oturu, Daniel",Toronto Raptors,10-day contract
12/23/21,"DeLaurier, Javin",,Milwaukee Bucks,10-day contract,2021-12-23,2021-22,"DeLaurier, Javin",Milwaukee Bucks,10-day contract
12/23/21,"Weatherspoon, Quinndary",,Golden State Warriors,10-day contract,2021-12-23,2021-22,"Weatherspoon, Quinndary",Golden State Warriors,10-day contract
12/23/21,"Knight, Brandon",,Dallas Mavericks,Two 10-day contracts (only 1st date is shown),2021-12-23,2021-22,"Knight, Brandon",Dallas Mavericks,Two 10-day contracts (only 1st date is shown)
12/23/21,"Jones, Carlik",,Dallas Mavericks,10-day contract,2021-12-23,2021-22,"Jones, Carlik",Dallas Mavericks,10-day contract
12/23/21,"Iwundu, Wesley",,Atlanta Hawks,10-day contract,2021-12-23,2021-22,"Iwundu, Wesley",Atlanta Hawks,10-day contract
12/23/21,"Brown, Charlie",,Dallas Mavericks,10-day contract,2021-12-23,2021-22,"Brown, Charlie",Dallas Mavericks,10-day contract
12/23/21,"House, Danuel",,New York Knicks,10-day contract,2021-12-23,2021-22,"House, Danuel",New York Knicks,10-day contract
12/23/21,"Morgan, Juwan",,Toronto Raptors,10-day contract,2021-12-23,2021-22,"Morgan, Juwan",Toronto Raptors,10-day contract
12/23/21,"Diallo, Cheick",,Detroit Pistons,10-day contract,2021-12-23,2021-22,"Diallo, Cheick",Detroit Pistons,10-day contract
12/22/21,"Cheatham, Zylan",,Miami Heat,10-day contract,2021-12-22,2021-22,"Cheatham, Zylan",Miami Heat,10-day contract
12/22/21,"Waters, Tremont",,Toronto Raptors,10-day contract,2021-12-22,2021-22,"Waters, Tremont",Toronto Raptors,10-day contract
12/22/21,"Wilson, D.J.",,Toronto Raptors,Three or more 10-day contracts (only 1st date is shown),2021-12-22,2021-22,"Wilson, D.J.",Toronto Raptors,Three or more 10-day contracts (only 1st date is shown)
12/22/21,"McClung, Mac",,Chicago Bulls,Two 10-day contracts (only 1st date is shown),2021-12-22,2021-22,"McClung, Mac",Chicago Bulls,Two 10-day contracts (only 1st date is shown)
12/22/21,"Ilyasova, Ersan",,Chicago Bulls,10-day contract,2021-12-22,2021-22,"Ilyasova, Ersan",Chicago Bulls,10-day contract
12/22/21,"Johnson, Joe",,Boston Celtics,10-day contract,2021-12-22,2021-22,"Johnson, Joe",Boston Celtics,10-day contract
12/22/21,"Murkey, Ade",,Sacramento Kings,10-day contract,2021-12-22,2021-22,"Murkey, Ade",Sacramento Kings,10-day contract
12/22/21,"Mudiay, Emmanuel",,Sacramento Kings,10-day contract,2021-12-22,2021-22,"Mudiay, Emmanuel",Sacramento Kings,10-day contract
12/22/21,"Johnson, Tyler",,Philadelphia 76ers,10-day contract,2021-12-22,2021-22,"Johnson, Tyler",Philadelphia 76ers,10-day contract
12/22/21,"King, George",,Dallas Mavericks,10-day contract,2021-12-22,2021-22,"King, George",Dallas Mavericks,10-day contract
12/22/21,"Schakel, Jordan",,Washington Wizards,10-day contract,2021-12-22,2021-22,"Schakel, Jordan",Washington Wizards,10-day contract
12/22/21,"Scott, Tre",,Cleveland Cavaliers,10-day contract,2021-12-22,2021-22,"Scott, Tre",Cleveland Cavaliers,10-day contract
12/22/21,"Hill, Malcolm",,Atlanta Hawks,10-day contract,2021-12-22,2021-22,"Hill, Malcolm",Atlanta Hawks,10-day contract
12/22/21,"Stephenson, Lance",,Atlanta Hawks,10-day contract,2021-12-22,2021-22,"Stephenson, Lance",Atlanta Hawks,10-day contract
12/21/21,"Wright, Moses",,Los Angeles Clippers,10-day contract,2021-12-21,2021-22,"Wright, Moses",Los Angeles Clippers,10-day contract
12/21/21,"Jones, Jemerrio",,Los Angeles Lakers,10-day contract,2021-12-21,2021-22,"Jones, Jemerrio",Los Angeles Lakers,10-day contract
12/21/21,"Chriss, Marquese",,Dallas Mavericks,Three or more 10-day contracts followed by signing for the rest of season,2021-12-21,2021-22,"Chriss, Marquese",Dallas Mavericks,Three or more 10-day contracts followed by signing for the rest of season
12/21/21,"Gabriel, Wenyen",,Brooklyn Nets,10-day contract,2021-12-21,2021-22,"Gabriel, Wenyen",Brooklyn Nets,10-day contract
12/21/21,"Silva, Chris",,Minnesota Timberwolves,10-day contract,2021-12-21,2021-22,"Silva, Chris",Minnesota Timberwolves,10-day contract
12/21/21,"Tucker, Rayjon",,Minnesota Timberwolves,10-day contract,2021-12-21,2021-22,"Tucker, Rayjon",Minnesota Timberwolves,10-day contract
12/21/21,"Gillespie, Freddie",,Orlando Magic,Two 10-day contracts (only 1st date is shown),2021-12-21,2021-22,"Gillespie, Freddie",Orlando Magic,Two 10-day contracts (only 1st date is shown)
12/21/21,"Mooney, Matt",,New York Knicks,Two 10-day contracts (only 1st date is shown),2021-12-21,2021-22,"Mooney, Matt",New York Knicks,Two 10-day contracts (only 1st date is shown)
12/21/21,"Anderson, Justin",,Cleveland Cavaliers,10-day contract,2021-12-21,2021-22,"Anderson, Justin",Cleveland Cavaliers,10-day contract
12/21/21,"Kornet, Luke",,Cleveland Cavaliers,10-day contract,2021-12-21,2021-22,"Kornet, Luke",Cleveland Cavaliers,10-day contract
12/21/21,"Frazier, Tim",,Orlando Magic,Two 10-day contracts (only 1st date is shown),2021-12-21,2021-22,"Frazier, Tim",Orlando Magic,Two 10-day contracts (only 1st date is shown)
12/21/21,"Dotson, Damyean",,New York Knicks,Two 10-day contracts (only 1st date is shown),2021-12-21,2021-22,"Dotson, Damyean",New York Knicks,Two 10-day contracts (only 1st date is shown)
12/20/21,"Pinson, Theo",,Dallas Mavericks,Two 10-day contracts (only 1st date is shown),2021-12-20,2021-22,"Pinson, Theo",Dallas Mavericks,Two 10-day contracts (only 1st date is shown)
12/20/21,"Miles, C.J.",,Boston Celtics,10-day contract,2021-12-20,2021-22,"Miles, C.J.",Boston Celtics,10-day contract
12/18/21,"Jackson, Justin",,Boston Celtics,10-day contract,2021-12-18,2021-22,"Jackson, Justin",Boston Celtics,10-day contract
12/18/21,"Hall, Tyler",,New York Knicks,10-day contract,2021-12-18,2021-22,"Hall, Tyler",New York Knicks,10-day contract
12/18/21,"Harrison, Shaquille",,Brooklyn Nets,Two 10-day contracts (only 1st date is shown),2021-12-18,2021-22,"Harrison, Shaquille",Brooklyn Nets,Two 10-day contracts (only 1st date is shown)
12/18/21,"Ennis, James",,Brooklyn Nets,10-day contract,2021-12-18,2021-22,"Ennis, James",Brooklyn Nets,10-day contract
12/17/21,"Schofield, Admiral",,Orlando Magic,Two 10-day contracts (only 1st date is shown),2021-12-17,2021-22,"Schofield, Admiral",Orlando Magic,Two 10-day contracts (only 1st date is shown)
12/17/21,"Gravett, Hassani",,Orlando Magic,Two 10-day contracts (only 1st date is shown),2021-12-17,2021-22,"Gravett, Hassani",Orlando Magic,Two 10-day contracts (only 1st date is shown)
12/17/21,"Johnson, B.J.",,Orlando Magic,10-day contract,2021-12-17,2021-22,"Johnson, B.J.",Orlando Magic,10-day contract
12/17/21,"Ford, Aleem",,Orlando Magic,10-day contract,2021-12-17,2021-22,"Ford, Aleem",Orlando Magic,10-day contract
12/17/21,"Thomas, Isaiah",,Los Angeles Lakers,10-day contract,2021-12-17,2021-22,"Thomas, Isaiah",Los Angeles Lakers,10-day contract
12/17/21,"Robinson, Justin",,Sacramento Kings,10-day contract,2021-12-17,2021-22,"Robinson, Justin",Sacramento Kings,10-day contract
12/16/21,"Galloway, Langston",,Brooklyn Nets,Two 10-day contracts (only 1st date is shown),2021-12-16,2021-22,"Galloway, Langston",Brooklyn Nets,Two 10-day contracts (only 1st date is shown)
12/10/21,"McKinnie, Alfonzo",,Chicago Bulls,10-day contract followed by signing for the rest of season,2021-12-10,2021-22,"McKinnie, Alfonzo",Chicago Bulls,10-day contract followed by signing for the rest of season
12/08/21,"Johnson, Stanley",,Chicago Bulls,10-day contract,2021-12-08,2021-22,"Johnson, Stanley",Chicago Bulls,10-day contract
12/04/21,"Reed, Davon",,Denver Nuggets,Three or more 10-day contracts (only 1st date is shown),2021-12-04,2021-22,"Reed, Davon",Denver Nuggets,Three or more 10-day contracts (only 1st date is shown)
05/14/21,"Reynolds, Cameron",,Houston Rockets,10-day contract,2021-05-14,2020-21,"Reynolds, Cameron",Houston Rockets,10-day contract
05/10/21,"Oliver, Cameron",,Houston Rockets,10-day contract,2021-05-10,2020-21,"Oliver, Cameron",Houston Rockets,10-day contract
05/07/21,"Thomas, Khyri",,Houston Rockets,10-day contract,2021-05-07,2020-21,"Thomas, Khyri",Houston Rockets,10-day contract
05/04/21,"Varejao, Anderson",,Cleveland Cavaliers,Two 10-day contracts (only 1st date is shown),2021-05-04,2020-21,"Varejao, Anderson",Cleveland Cavaliers,Two 10-day contracts (only 1st date is shown)
05/02/21,"Brazdeikis, Ignas",,Orlando Magic,10-day contract followed by signing for the rest of season,2021-05-02,2020-21,"Brazdeikis, Ignas",Orlando Magic,10-day contract followed by signing for the rest of season
04/25/21,"Brown, Charlie",,Oklahoma City Thunder,Two 10-day contracts followed by signing for the rest of season,2021-04-25,2020-21,"Brown, Charlie",Oklahoma City Thunder,Two 10-day contracts followed by signing for the rest of season
04/23/21,"James, Mike",,Brooklyn Nets,Two 10-day contracts followed by signing for the rest of season,2021-04-23,2020-21,"James, Mike",Brooklyn Nets,Two 10-day contracts followed by signing for the rest of season
04/23/21,"Harper, Jared",,New York Knicks,10-day contract,2021-04-23,2020-21,"Harper, Jared",New York Knicks,10-day contract
04/20/21,"Rivers, Austin",,Denver Nuggets,10-day contract followed by signing for the rest of season,2021-04-20,2020-21,"Rivers, Austin",Denver Nuggets,10-day contract followed by signing for the rest of season
04/19/21,"Ferrell, Yogi",,Los Angeles Clippers,10-day contract followed by signing for the rest of season,2021-04-19,2020-21,"Ferrell, Yogi",Los Angeles Clippers,10-day contract followed by signing for the rest of season
04/14/21,"Bell, Jordan",,Washington Wizards,10-day contract,2021-04-14,2020-21,"Bell, Jordan",Washington Wizards,10-day contract
04/14/21,"Frazier, Tim",,Memphis Grizzlies,10-day contract followed by signing for the rest of season,2021-04-14,2020-21,"Frazier, Tim",Memphis Grizzlies,10-day contract followed by signing for the rest of season
04/13/21,"Hall, Donta",,Orlando Magic,Two 10-day contracts followed by signing for the rest of season,2021-04-13,2020-21,"Hall, Donta",Orlando Magic,Two 10-day contracts followed by signing for the rest of season
04/12/21,"Franks, Robert",,Orlando Magic,Two 10-day contracts (only 1st date is shown),2021-04-12,2020-21,"Franks, Robert",Orlando Magic,Two 10-day contracts (only 1st date is shown)
04/12/21,"Tolliver, Anthony",,Philadelphia 76ers,Two 10-day contracts followed by signing for the rest of season,2021-04-12,2020-21,"Tolliver, Anthony",Philadelphia 76ers,Two 10-day contracts followed by signing for the rest of season
04/10/21,"Kabengele, Mfiondu",,Cleveland Cavaliers,Two 10-day contracts followed by signing for the rest of season,2021-04-10,2020-21,"Kabengele, Mfiondu",Cleveland Cavaliers,Two 10-day contracts followed by signing for the rest of season
04/09/21,"Fitts, Malik",,Los Angeles Clippers,10-day contract,2021-04-09,2020-21,"Fitts, Malik",Los Angeles Clippers,10-day contract
04/08/21,"Hollis-Jefferson, Rondae",,Portland Trail Blazers,Two 10-day contracts followed by signing for the rest of season,2021-04-08,2020-21,"Hollis-Jefferson, Rondae",Portland Trail Blazers,Two 10-day contracts followed by signing for the rest of season
04/08/21,"Payton II, Gary",,Golden State Warriors,Two 10-day contracts followed by signing for the rest of season,2021-04-08,2020-21,"Payton II, Gary",Golden State Warriors,Two 10-day contracts followed by signing for the rest of season
04/08/21,"Gillespie, Freddie",,Toronto Raptors,Two 10-day contracts followed by signing for the rest of season,2021-04-08,2020-21,"Gillespie, Freddie",Toronto Raptors,Two 10-day contracts followed by signing for the rest of season
04/07/21,"Jones, Damian",,Sacramento Kings,Two 10-day contracts (only 1st date is shown),2021-04-07,2020-21,"Jones, Damian",Sacramento Kings,Two 10-day contracts (only 1st date is shown)
04/06/21,"Cannady, Devin",,Orlando Magic,10-day contract,2021-04-06,2020-21,"Cannady, Devin",Orlando Magic,10-day contract
04/05/21,"Robinson, Justin",,Oklahoma City Thunder,Two 10-day contracts (only 1st date is shown),2021-04-05,2020-21,"Robinson, Justin",Oklahoma City Thunder,Two 10-day contracts (only 1st date is shown)
04/05/21,"Cousins, DeMarcus",,Los Angeles Clippers,Two 10-day contracts followed by signing for the rest of season,2021-04-05,2020-21,"Cousins, DeMarcus",Los Angeles Clippers,Two 10-day contracts followed by signing for the rest of season
04/05/21,"Henson, John",,New York Knicks,10-day contract,2021-04-05,2020-21,"Henson, John",New York Knicks,10-day contract
04/03/21,"Thomas, Isaiah",,New Orleans Pelicans,10-day contract,2021-04-03,2020-21,"Thomas, Isaiah",New Orleans Pelicans,10-day contract
04/02/21,"Pelle, Norvel",,New York Knicks,Two 10-day contracts followed by signing for the rest of season,2021-04-02,2020-21,"Pelle, Norvel",New York Knicks,Two 10-day contracts followed by signing for the rest of season
04/01/21,"Brissett, Oshae",,Indiana Pacers,Two 10-day contracts followed by signing for the rest of season,2021-04-01,2020-21,"Brissett, Oshae",Indiana Pacers,Two 10-day contracts followed by signing for the rest of season
03/26/21,"Reynolds, Cameron",,San Antonio Spurs,10-day contract,2021-03-26,2020-21,"Reynolds, Cameron",San Antonio Spurs,10-day contract
03/22/21,"Johnson, Alize",,Brooklyn Nets,Two 10-day contracts followed by signing for the rest of season,2021-03-22,2020-21,"Johnson, Alize",Brooklyn Nets,Two 10-day contracts followed by signing for the rest of season
03/18/21,"Cook, Tyler",,Detroit Pistons,Two 10-day contracts followed by signing for the rest of season,2021-03-18,2020-21,"Cook, Tyler",Detroit Pistons,Two 10-day contracts followed by signing for the rest of season
03/12/21,"Cook, Quinn",,Cleveland Cavaliers,Two 10-day contracts (only 1st date is shown),2021-03-12,2020-21,"Cook, Quinn",Cleveland Cavaliers,Two 10-day contracts (only 1st date is shown)
03/11/21,"Jones, Mason",,Houston Rockets,10-day contract,2021-03-11,2020-21,"Jones, Mason",Houston Rockets,10-day contract
03/10/21,"Ellenson, Henry",,Toronto Raptors,10-day contract,2021-03-10,2020-21,"Ellenson, Henry",Toronto Raptors,10-day contract
02/26/21,"Hall, Donta",,Toronto Raptors,10-day contract,2021-02-26,2020-21,"Hall, Donta",Toronto Raptors,10-day contract
02/26/21,"Jones, Damian",,Los Angeles Lakers,Two 10-day contracts (only 1st date is shown),2021-02-26,2020-21,"Jones, Damian",Los Angeles Lakers,Two 10-day contracts (only 1st date is shown)
02/26/21,"Shumpert, Iman",,Brooklyn Nets,10-day contract,2021-02-26,2020-21,"Shumpert, Iman",Brooklyn Nets,10-day contract
02/26/21,"Roberson, Andre",,Brooklyn Nets,10-day contract,2021-02-26,2020-21,"Roberson, Andre",Brooklyn Nets,10-day contract
02/25/21,"Pelle, Norvel",,Sacramento Kings,10-day contract,2021-02-25,2020-21,"Pelle, Norvel",Sacramento Kings,10-day contract
02/24/21,"Cook, Tyler",,Brooklyn Nets,10-day contract,2021-02-24,2020-21,"Cook, Tyler",Brooklyn Nets,10-day contract
02/24/21,"Thornwell, Sindarius",,New Orleans Pelicans,Two 10-day contracts (only 1st date is shown),2021-02-24,2020-21,"Thornwell, Sindarius",New Orleans Pelicans,Two 10-day contracts (only 1st date is shown)
01/23/21,"Bell, Jordan",,Washington Wizards,10-day contract,2021-01-23,2020-21,"Bell, Jordan",Washington Wizards,10-day contract
01/11/21,"Ferrell, Yogi",,Cleveland Cavaliers,10-day contract,2021-01-11,2020-21,"Ferrell, Yogi",Cleveland Cavaliers,10-day contract
01/04/21,"Frazier, Tim",,Memphis Grizzlies,10-day contract,2021-01-04,2020-21,"Frazier, Tim",Memphis Grizzlies,10-day contract
03/09/20,"Noah, Joakim",,Los Angeles Clippers,10-day contract followed by signing for the rest of season,2020-03-09,2019-20,"Noah, Joakim",Los Angeles Clippers,10-day contract followed by signing for the rest of season
03/08/20,"Mac, Sheldon",,Cleveland Cavaliers,10-day contract,2020-03-08,2019-20,"Mac, Sheldon",Cleveland Cavaliers,10-day contract
03/04/20,"Pointer, Sir'Dominic",,Cleveland Cavaliers,10-day contract,2020-03-04,2019-20,"Pointer, Sir'Dominic",Cleveland Cavaliers,10-day contract
03/03/20,"Randle, Chasson",,Golden State Warriors,10-day contract,2020-03-03,2019-20,"Randle, Chasson",Golden State Warriors,10-day contract
03/02/20,"Tolliver, Anthony",,Memphis Grizzlies,10-day contract followed by signing for the rest of season,2020-03-02,2019-20,"Tolliver, Anthony",Memphis Grizzlies,10-day contract followed by signing for the rest of season
02/27/20,"Uthoff, Jarrod",,Memphis Grizzlies,10-day contract,2020-02-27,2019-20,"Uthoff, Jarrod",Memphis Grizzlies,10-day contract
02/27/20,"Mulder, Mychal",,Golden State Warriors,10-day contract followed by signing for the rest of season,2020-02-27,2019-20,"Mulder, Mychal",Golden State Warriors,10-day contract followed by signing for the rest of season
02/23/20,"Bender, Dragan",,Golden State Warriors,Two 10-day contracts (only 1st date is shown),2020-02-23,2019-20,"Bender, Dragan",Golden State Warriors,Two 10-day contracts (only 1st date is shown)
02/22/20,"Hall, Donta",,Detroit Pistons,Two 10-day contracts (only 1st date is shown),2020-02-22,2019-20,"Hall, Donta",Detroit Pistons,Two 10-day contracts (only 1st date is shown)
02/21/20,"Chealey, Joe",,Charlotte Hornets,Two 10-day contracts (only 1st date is shown),2020-02-21,2019-20,"Chealey, Joe",Charlotte Hornets,Two 10-day contracts (only 1st date is shown)
02/21/20,"Walton, Derrick",,Detroit Pistons,10-day contract,2020-02-21,2019-20,"Walton, Derrick",Detroit Pistons,10-day contract
02/21/20,"Hannahs, Dusty",,Memphis Grizzlies,10-day contract,2020-02-21,2019-20,"Hannahs, Dusty",Memphis Grizzlies,10-day contract
02/18/20,"Green, Jeff",,Houston Rockets,10-day contract followed by signing for the rest of season,2020-02-18,2019-20,"Green, Jeff",Houston Rockets,10-day contract followed by signing for the rest of season
02/12/20,"Bolden, Jonah",,Phoenix Suns,10-day contract,2020-02-12,2019-20,"Bolden, Jonah",Phoenix Suns,10-day contract
02/09/20,"Macura, J.P.",,Cleveland Cavaliers,10-day contract,2020-02-09,2019-20,"Macura, J.P.",Cleveland Cavaliers,10-day contract
02/09/20,"Newman, Malik",,Cleveland Cavaliers,10-day contract,2020-02-09,2019-20,"Newman, Malik",Cleveland Cavaliers,10-day contract
02/08/20,"Norvell, Zach",,Golden State Warriors,10-day contract,2020-02-08,2019-20,"Norvell, Zach",Golden State Warriors,10-day contract
02/08/20,"Pargo, Jeremy",,Golden State Warriors,10-day contract,2020-02-08,2019-20,"Pargo, Jeremy",Golden State Warriors,10-day contract
02/01/20,"Mika, Eric",,Sacramento Kings,10-day contract,2020-02-01,2019-20,"Mika, Eric",Sacramento Kings,10-day contract
01/30/20,"Bolden, Marques",,Cleveland Cavaliers,10-day contract,2020-01-30,2019-20,"Bolden, Marques",Cleveland Cavaliers,10-day contract
01/15/20,"Luwawu-Cabarrot, Timothe",,Brooklyn Nets,Two 10-day contracts followed by signing for the rest of season,2020-01-15,2019-20,"Luwawu-Cabarrot, Timothe",Brooklyn Nets,Two 10-day contracts followed by signing for the rest of season
01/14/20,"Clark, Gary",,Orlando Magic,Two 10-day contracts followed by signing for the rest of season,2020-01-14,2019-20,"Clark, Gary",Orlando Magic,Two 10-day contracts followed by signing for the rest of season
01/11/20,"Magette, Josh",,Orlando Magic,10-day contract,2020-01-11,2019-20,"Magette, Josh",Orlando Magic,10-day contract
01/09/20,"McKinnie, Alfonzo",,Cleveland Cavaliers,Two 10-day contracts followed by signing for the rest of season,2020-01-09,2019-20,"McKinnie, Alfonzo",Cleveland Cavaliers,Two 10-day contracts followed by signing for the rest of season
01/09/20,"Cook, Tyler",,Cleveland Cavaliers,Two 10-day contracts (only 1st date is shown),2020-01-09,2019-20,"Cook, Tyler",Cleveland Cavaliers,Two 10-day contracts (only 1st date is shown)
01/06/20,"Watson, Paul",,Atlanta Hawks,10-day contract,2020-01-06,2019-20,"Watson, Paul",Atlanta Hawks,10-day contract
01/06/20,"Anderson, Justin",,Brooklyn Nets,10-day contract,2020-01-06,2019-20,"Anderson, Justin",Brooklyn Nets,10-day contract
03/31/19,"Sampson, JaKarr",,Chicago Bulls,10-day contract,2019-03-31,2018-19,"Sampson, JaKarr",Chicago Bulls,10-day contract
03/30/19,"Creek, Mitch",,Minnesota Timberwolves,10-day contract followed by signing for the rest of season,2019-03-30,2018-19,"Creek, Mitch",Minnesota Timberwolves,10-day contract followed by signing for the rest of season
03/30/19,"Hannahs, Dusty",,Memphis Grizzlies,10-day contract,2019-03-30,2018-19,"Hannahs, Dusty",Memphis Grizzlies,10-day contract
03/24/19,"Monroe, Greg",,Boston Celtics,10-day contract,2019-03-24,2018-19,"Monroe, Greg",Boston Celtics,10-day contract
03/22/19,"Demps, Cody",,Sacramento Kings,10-day contract,2019-03-22,2018-19,"Demps, Cody",Sacramento Kings,10-day contract
03/21/19,"Machado, Scott",,Los Angeles Lakers,10-day contract,2019-03-21,2018-19,"Machado, Scott",Los Angeles Lakers,10-day contract
03/19/19,"Davis, Deyonta",,Atlanta Hawks,Two 10-day contracts followed by signing for the rest of season,2019-03-19,2018-19,"Davis, Deyonta",Atlanta Hawks,Two 10-day contracts followed by signing for the rest of season
03/15/19,"Carter-Williams, Michael",,Orlando Magic,Two 10-day contracts (only 1st date is shown),2019-03-15,2018-19,"Carter-Williams, Michael",Orlando Magic,Two 10-day contracts (only 1st date is shown)
03/15/19,"Cooke, Charles",,Miami Heat,10-day contract,2019-03-15,2018-19,"Cooke, Charles",Miami Heat,10-day contract
03/14/19,"Moreland, Eric",,Toronto Raptors,10-day contract followed by signing for the rest of season,2019-03-14,2018-19,"Moreland, Eric",Toronto Raptors,10-day contract followed by signing for the rest of season
03/13/19,"Bibbs, Justin",,Los Angeles Clippers,Two 10-day contracts (only 1st date is shown),2019-03-13,2018-19,"Bibbs, Justin",Los Angeles Clippers,Two 10-day contracts (only 1st date is shown)
03/11/19,"Ingram, Andre",,Los Angeles Lakers,10-day contract,2019-03-11,2018-19,"Ingram, Andre",Los Angeles Lakers,10-day contract
03/08/19,"Zeller, Tyler",,Atlanta Hawks,10-day contract,2019-03-08,2018-19,"Zeller, Tyler",Atlanta Hawks,10-day contract
03/01/19,"Johnson, B.J.",,Atlanta Hawks,Two 10-day contracts (only 1st date is shown),2019-03-01,2018-19,"Johnson, B.J.",Atlanta Hawks,Two 10-day contracts (only 1st date is shown)
02/27/19,"Reynolds, Cameron",,Minnesota Timberwolves,Two 10-day contracts followed by signing for the rest of season,2019-02-27,2018-19,"Reynolds, Cameron",Minnesota Timberwolves,Two 10-day contracts followed by signing for the rest of season
02/26/19,"McCall, Tahjere",,Brooklyn Nets,10-day contract,2019-02-26,2018-19,"McCall, Tahjere",Brooklyn Nets,10-day contract
02/25/19,"Canaan, Isaiah",,Milwaukee Bucks,10-day contract,2019-02-25,2018-19,"Canaan, Isaiah",Milwaukee Bucks,10-day contract
02/22/19,"Jones, Terrence",,Houston Rockets,Two 10-day contracts (only 1st date is shown),2019-02-22,2018-19,"Jones, Terrence",Houston Rockets,Two 10-day contracts (only 1st date is shown)
02/22/19,"Chiozza, Chris",,Houston Rockets,10-day contract followed by signing for the rest of season,2019-02-22,2018-19,"Chiozza, Chris",Houston Rockets,10-day contract followed by signing for the rest of season
02/21/19,"Spalding, Ray",,Phoenix Suns,10-day contract followed by signing for the rest of season,2019-02-21,2018-19,"Spalding, Ray",Phoenix Suns,10-day contract followed by signing for the rest of season
02/20/19,"Terry, Emanuel",,Miami Heat,10-day contract,2019-02-20,2018-19,"Terry, Emanuel",Miami Heat,10-day contract
02/20/19,"Sibert, Jordan",,Atlanta Hawks,10-day contract,2019-02-20,2018-19,"Sibert, Jordan",Atlanta Hawks,10-day contract
02/20/19,"Ellenson, Henry",,New York Knicks,10-day contract followed by signing for the rest of season,2019-02-20,2018-19,"Ellenson, Henry",New York Knicks,10-day contract followed by signing for the rest of season
02/20/19,"Meeks, Jodie",,Toronto Raptors,10-day contract followed by signing for the rest of season,2019-02-20,2018-19,"Meeks, Jodie",Toronto Raptors,10-day contract followed by signing for the rest of season
02/14/19,"Hopson, Scotty",,Oklahoma City Thunder,10-day contract,2019-02-14,2018-19,"Hopson, Scotty",Oklahoma City Thunder,10-day contract
02/14/19,"Solomon, Richard",,Oklahoma City Thunder,10-day contract,2019-02-14,2018-19,"Solomon, Richard",Oklahoma City Thunder,10-day contract
02/11/19,"Jenkins, John",,New York Knicks,10-day contract followed by signing for the rest of season,2019-02-11,2018-19,"Jenkins, John",New York Knicks,10-day contract followed by signing for the rest of season
02/08/19,"Brewer, Corey",,Sacramento Kings,Two 10-day contracts followed by signing for the rest of season,2019-02-08,2018-19,"Brewer, Corey",Sacramento Kings,Two 10-day contracts followed by signing for the rest of season
01/31/19,"Jenkins, John",,Washington Wizards,10-day contract,2019-01-31,2018-19,"Jenkins, John",Washington Wizards,10-day contract
01/30/19,"Canaan, Isaiah",,Minnesota Timberwolves,Two 10-day contracts (only 1st date is shown),2019-01-30,2018-19,"Canaan, Isaiah",Minnesota Timberwolves,Two 10-day contracts (only 1st date is shown)
01/27/19,"Terry, Emanuel",,Phoenix Suns,10-day contract,2019-01-27,2018-19,"Terry, Emanuel",Phoenix Suns,10-day contract
01/27/19,"Simmons, Kobi",,Cleveland Cavaliers,10-day contract,2019-01-27,2018-19,"Simmons, Kobi",Cleveland Cavaliers,10-day contract
01/25/19,"Creek, Mitch",,Brooklyn Nets,Two 10-day contracts (only 1st date is shown),2019-01-25,2018-19,"Creek, Mitch",Brooklyn Nets,Two 10-day contracts (only 1st date is shown)
01/24/19,"Caboclo, Bruno",,Memphis Grizzlies,Two 10-day contracts followed by signing for the rest of season,2019-01-24,2018-19,"Caboclo, Bruno",Memphis Grizzlies,Two 10-day contracts followed by signing for the rest of season
01/21/19,"Payton II, Gary",,Washington Wizards,10-day contract,2019-01-21,2018-19,"Payton II, Gary",Washington Wizards,10-day contract
01/20/19,"Hicks, Stephan",,Indiana Pacers,10-day contract,2019-01-20,2018-19,"Hicks, Stephan",Indiana Pacers,10-day contract
01/16/19,"Nunnally, James",,Houston Rockets,10-day contract,2019-01-16,2018-19,"Nunnally, James",Houston Rockets,10-day contract
01/15/19,"Brewer, Corey",,Philadelphia 76ers,Two 10-day contracts (only 1st date is shown),2019-01-15,2018-19,"Brewer, Corey",Philadelphia 76ers,Two 10-day contracts (only 1st date is shown)
01/07/19,"Acy, Quincy",,Phoenix Suns,Two 10-day contracts (only 1st date is shown),2019-01-07,2018-19,"Acy, Quincy",Phoenix Suns,Two 10-day contracts (only 1st date is shown)
01/06/19,"Payne, Cameron",,Cleveland Cavaliers,Two 10-day contracts (only 1st date is shown),2019-01-06,2018-19,"Payne, Cameron",Cleveland Cavaliers,Two 10-day contracts (only 1st date is shown)
04/01/18,"Evans, Jeremy",,Atlanta Hawks,10-day contract,2018-04-01,2017-18,"Evans, Jeremy",Atlanta Hawks,10-day contract
03/28/18,"Silas, Xavier",,Boston Celtics,10-day contract,2018-03-28,2017-18,"Silas, Xavier",Boston Celtics,10-day contract
03/27/18,"Brooks, MarShon",,Memphis Grizzlies,10-day contract followed by signing for the rest of season,2018-03-27,2017-18,"Brooks, MarShon",Memphis Grizzlies,10-day contract followed by signing for the rest of season
03/24/18,"Teague, Marquis",,Memphis Grizzlies,10-day contract followed by signing for the rest of season,2018-03-24,2017-18,"Teague, Marquis",Memphis Grizzlies,10-day contract followed by signing for the rest of season
03/23/18,"Nash, Le'Bryan",,Houston Rockets,10-day contract,2018-03-23,2017-18,"Nash, Le'Bryan",Houston Rockets,10-day contract
03/22/18,"Harrison, Aaron",,Dallas Mavericks,10-day contract followed by signing for the rest of season,2018-03-22,2017-18,"Harrison, Aaron",Dallas Mavericks,10-day contract followed by signing for the rest of season
03/18/18,"White, Okaro",,Cleveland Cavaliers,10-day contract followed by signing for the rest of season,2018-03-18,2017-18,"White, Okaro",Cleveland Cavaliers,10-day contract followed by signing for the rest of season
03/17/18,"Stockton, David",,Utah Jazz,Two 10-day contracts followed by signing for the rest of season,2018-03-17,2017-18,"Stockton, David",Utah Jazz,Two 10-day contracts followed by signing for the rest of season
03/15/18,"Drew II, Larry",,New Orleans Pelicans,Two 10-day contracts (only 1st date is shown),2018-03-15,2017-18,"Drew II, Larry",New Orleans Pelicans,Two 10-day contracts (only 1st date is shown)
03/14/18,"Weber, Briante",,Memphis Grizzlies,10-day contract,2018-03-14,2017-18,"Weber, Briante",Memphis Grizzlies,10-day contract
03/13/18,"Lee, Damion",,Atlanta Hawks,Two 10-day contracts followed by signing for the rest of season,2018-03-13,2017-18,"Lee, Damion",Atlanta Hawks,Two 10-day contracts followed by signing for the rest of season
03/11/18,"Jennings, Brandon",,Milwaukee Bucks,Two 10-day contracts followed by signing for the rest of season,2018-03-11,2017-18,"Jennings, Brandon",Milwaukee Bucks,Two 10-day contracts followed by signing for the rest of season
03/11/18,"Warney, Jameel",,Dallas Mavericks,10-day contract,2018-03-11,2017-18,"Warney, Jameel",Dallas Mavericks,10-day contract
03/09/18,"Williams, Derrick",,Los Angeles Lakers,10-day contract,2018-03-09,2017-18,"Williams, Derrick",Los Angeles Lakers,10-day contract
03/08/18,"Purvis, Rodney",,Orlando Magic,Two 10-day contracts followed by signing for the rest of season,2018-03-08,2017-18,"Purvis, Rodney",Orlando Magic,Two 10-day contracts followed by signing for the rest of season
03/08/18,"Papagiannis, Georgios",,Portland Trail Blazers,10-day contract followed by signing for the rest of season,2018-03-08,2017-18,"Papagiannis, Georgios",Portland Trail Blazers,10-day contract followed by signing for the rest of season
03/06/18,"Hayes-Davis, Nigel",,Toronto Raptors,Two 10-day contracts (only 1st date is shown),2018-03-06,2017-18,"Hayes-Davis, Nigel",Toronto Raptors,Two 10-day contracts (only 1st date is shown)
03/05/18,"Rathan-Mayes, Xavier",,Memphis Grizzlies,10-day contract,2018-03-05,2017-18,"Rathan-Mayes, Xavier",Memphis Grizzlies,10-day contract
03/04/18,"Kilpatrick, Sean",,Los Angeles Clippers,Two 10-day contracts (only 1st date is shown),2018-03-04,2017-18,"Kilpatrick, Sean",Los Angeles Clippers,Two 10-day contracts (only 1st date is shown)
03/02/18,"Wear, Travis",,Los Angeles Lakers,Two 10-day contracts followed by signing for the rest of season,2018-03-02,2017-18,"Wear, Travis",Los Angeles Lakers,Two 10-day contracts followed by signing for the rest of season
03/01/18,"Eddie, Jarell",,Chicago Bulls,10-day contract,2018-03-01,2017-18,"Eddie, Jarell",Chicago Bulls,10-day contract
02/28/18,"Morris, Jaylen",,Atlanta Hawks,Two 10-day contracts followed by signing for the rest of season,2018-02-28,2017-18,"Morris, Jaylen",Atlanta Hawks,Two 10-day contracts followed by signing for the rest of season
02/26/18,"Hopson, Scotty",,Dallas Mavericks,10-day contract,2018-02-26,2017-18,"Hopson, Scotty",Dallas Mavericks,10-day contract
02/23/18,"Sessions, Ramon",,Washington Wizards,Two 10-day contracts followed by signing for the rest of season,2018-02-23,2017-18,"Sessions, Ramon",Washington Wizards,Two 10-day contracts followed by signing for the rest of season
02/22/18,"Thornton, Marcus",,Cleveland Cavaliers,10-day contract,2018-02-22,2017-18,"Thornton, Marcus",Cleveland Cavaliers,10-day contract
02/22/18,"Cleveland, Antonius",,Atlanta Hawks,Two 10-day contracts followed by signing for the rest of season,2018-02-22,2017-18,"Cleveland, Antonius",Atlanta Hawks,Two 10-day contracts followed by signing for the rest of season
02/21/18,"Harrison, Shaquille",,Phoenix Suns,Two 10-day contracts followed by signing for the rest of season,2018-02-21,2017-18,"Harrison, Shaquille",Phoenix Suns,Two 10-day contracts followed by signing for the rest of season
02/21/18,"Lemon Jr., Walter",,New Orleans Pelicans,Two 10-day contracts (only 1st date is shown),2018-02-21,2017-18,"Lemon Jr., Walter",New Orleans Pelicans,Two 10-day contracts (only 1st date is shown)
02/21/18,"Rush, Brandon",,Portland Trail Blazers,10-day contract,2018-02-21,2017-18,"Rush, Brandon",Portland Trail Blazers,10-day contract
02/21/18,"McKinney Jones, Trey",,Indiana Pacers,10-day contract,2018-02-21,2017-18,"McKinney Jones, Trey",Indiana Pacers,10-day contract
02/21/18,"Williams, Troy",,New York Knicks,Two 10-day contracts followed by signing for the rest of season,2018-02-21,2017-18,"Williams, Troy",New York Knicks,Two 10-day contracts followed by signing for the rest of season
02/20/18,"Vaughn, Rashad",,Orlando Magic,Two 10-day contracts (only 1st date is shown),2018-02-20,2017-18,"Vaughn, Rashad",Orlando Magic,Two 10-day contracts (only 1st date is shown)
02/11/18,"Mitrou-Long, Naz",,Utah Jazz,Two 10-day contracts (only 1st date is shown),2018-02-11,2017-18,"Mitrou-Long, Naz",Utah Jazz,Two 10-day contracts (only 1st date is shown)
02/03/18,"Okafor, Emeka",,New Orleans Pelicans,Two 10-day contracts followed by signing for the rest of season,2018-02-03,2017-18,"Okafor, Emeka",New Orleans Pelicans,Two 10-day contracts followed by signing for the rest of season
02/02/18,"Gray, Josh",,Phoenix Suns,Two 10-day contracts (only 1st date is shown),2018-02-02,2017-18,"Gray, Josh",Phoenix Suns,Two 10-day contracts (only 1st date is shown)
01/23/18,"Drew II, Larry",,Philadelphia 76ers,10-day contract,2018-01-23,2017-18,"Drew II, Larry",Philadelphia 76ers,10-day contract
01/20/18,"Eddie, Jarell",,Boston Celtics,10-day contract,2018-01-20,2017-18,"Eddie, Jarell",Boston Celtics,10-day contract
01/19/18,"Hayes-Davis, Nigel",,Los Angeles Lakers,10-day contract,2018-01-19,2017-18,"Hayes-Davis, Nigel",Los Angeles Lakers,10-day contract
01/13/18,"Collinsworth, Kyle",,Dallas Mavericks,Two 10-day contracts followed by signing for the rest of season,2018-01-13,2017-18,"Collinsworth, Kyle",Dallas Mavericks,Two 10-day contracts followed by signing for the rest of season
01/10/18,"Liggins, DeAndre",,New Orleans Pelicans,Two 10-day contracts followed by signing for the rest of season,2018-01-10,2017-18,"Liggins, DeAndre",New Orleans Pelicans,Two 10-day contracts followed by signing for the rest of season
01/05/18,"Jackson, Demetrius",,Houston Rockets,10-day contract,2018-01-05,2017-18,"Jackson, Demetrius",Houston Rockets,10-day contract
04/02/17,"Poythress, Alex",,Philadelphia 76ers,10-day contract followed by signing for the rest of season,2017-04-02,2016-17,"Poythress, Alex",Philadelphia 76ers,10-day contract followed by signing for the rest of season
03/19/17,"Eddie, Jarell",,Phoenix Suns,Two 10-day contracts (only 1st date is shown),2017-03-19,2016-17,"Eddie, Jarell",Phoenix Suns,Two 10-day contracts (only 1st date is shown)
03/19/17,"Cook, Quinn",,New Orleans Pelicans,Two 10-day contracts followed by signing for the rest of season,2017-03-19,2016-17,"Cook, Quinn",New Orleans Pelicans,Two 10-day contracts followed by signing for the rest of season
03/15/17,"Goodwin, Archie",,Brooklyn Nets,Two 10-day contracts followed by signing for the rest of season,2017-03-15,2016-17,"Goodwin, Archie",Brooklyn Nets,Two 10-day contracts followed by signing for the rest of season
03/10/17,"Williams, Troy",,Houston Rockets,10-day contract followed by signing for the rest of season,2017-03-10,2016-17,"Williams, Troy",Houston Rockets,10-day contract followed by signing for the rest of season
03/09/17,"Harris, Manny",,Dallas Mavericks,Two 10-day contracts (only 1st date is shown),2017-03-09,2016-17,"Harris, Manny",Dallas Mavericks,Two 10-day contracts (only 1st date is shown)
03/09/17,"Uthoff, Jarrod",,Dallas Mavericks,Two 10-day contracts followed by signing for the rest of season,2017-03-09,2016-17,"Uthoff, Jarrod",Dallas Mavericks,Two 10-day contracts followed by signing for the rest of season
03/08/17,"Selden, Wayne",,New Orleans Pelicans,10-day contract,2017-03-08,2016-17,"Selden, Wayne",New Orleans Pelicans,10-day contract
03/06/17,"Long, Shawn",,Philadelphia 76ers,10-day contract followed by signing for the rest of season,2017-03-06,2016-17,"Long, Shawn",Philadelphia 76ers,10-day contract followed by signing for the rest of season
03/06/17,"Crawford, Jordan",,New Orleans Pelicans,10-day contract followed by signing for the rest of season,2017-03-06,2016-17,"Crawford, Jordan",New Orleans Pelicans,10-day contract followed by signing for the rest of season
03/03/17,"Harper, Justin",,Philadelphia 76ers,10-day contract,2017-03-03,2016-17,"Harper, Justin",Philadelphia 76ers,10-day contract
02/28/17,"Nwaba, David",,Los Angeles Lakers,Two 10-day contracts followed by signing for the rest of season,2017-02-28,2016-17,"Nwaba, David",Los Angeles Lakers,Two 10-day contracts followed by signing for the rest of season
02/27/17,"Weber, Briante",,Charlotte Hornets,Two 10-day contracts followed by signing for the rest of season,2017-02-27,2016-17,"Weber, Briante",Charlotte Hornets,Two 10-day contracts followed by signing for the rest of season
02/26/17,"Bentil, Ben",,Dallas Mavericks,10-day contract,2017-02-26,2016-17,"Bentil, Ben",Dallas Mavericks,10-day contract
02/26/17,"Cook, Quinn",,Dallas Mavericks,10-day contract,2017-02-26,2016-17,"Cook, Quinn",Dallas Mavericks,10-day contract
02/25/17,"Toupane, Axel",,Milwaukee Bucks,10-day contract,2017-02-25,2016-17,"Toupane, Axel",Milwaukee Bucks,10-day contract
02/25/17,"Williams, Reggie",,New Orleans Pelicans,10-day contract,2017-02-25,2016-17,"Williams, Reggie",New Orleans Pelicans,10-day contract
02/24/17,"Jack, Jarrett",,New Orleans Pelicans,10-day contract,2017-02-24,2016-17,"Jack, Jarrett",New Orleans Pelicans,10-day contract
02/24/17,"O'Bryant, Johnny",,Charlotte Hornets,Two 10-day contracts followed by signing for the rest of season,2017-02-24,2016-17,"O'Bryant, Johnny",Charlotte Hornets,Two 10-day contracts followed by signing for the rest of season
02/23/17,"Thompson, Hollis",,New Orleans Pelicans,Two 10-day contracts (only 1st date is shown),2017-02-23,2016-17,"Thompson, Hollis",New Orleans Pelicans,Two 10-day contracts (only 1st date is shown)
02/09/17,"Williams, Derrick",,Cleveland Cavaliers,Two 10-day contracts followed by signing for the rest of season,2017-02-09,2016-17,"Williams, Derrick",Cleveland Cavaliers,Two 10-day contracts followed by signing for the rest of season
02/08/17,"Stephenson, Lance",,Minnesota Timberwolves,Two 10-day contracts (only 1st date is shown),2017-02-08,2016-17,"Stephenson, Lance",Minnesota Timberwolves,Two 10-day contracts (only 1st date is shown)
02/08/17,"Georges-Hunt, Marcus",,Miami Heat,10-day contract,2017-02-08,2016-17,"Georges-Hunt, Marcus",Miami Heat,10-day contract
02/04/17,"Weber, Briante",,Golden State Warriors,Two 10-day contracts (only 1st date is shown),2017-02-04,2016-17,"Weber, Briante",Golden State Warriors,Two 10-day contracts (only 1st date is shown)
02/03/17,"Tobey, Mike",,Charlotte Hornets,Two 10-day contracts (only 1st date is shown),2017-02-03,2016-17,"Tobey, Mike",Charlotte Hornets,Two 10-day contracts (only 1st date is shown)
02/03/17,"McCallum, Ray",,Charlotte Hornets,Two 10-day contracts (only 1st date is shown),2017-02-03,2016-17,"McCallum, Ray",Charlotte Hornets,Two 10-day contracts (only 1st date is shown)
01/30/17,"Douglas, Toney",,Memphis Grizzlies,Two 10-day contracts followed by signing for the rest of season,2017-01-30,2016-17,"Douglas, Toney",Memphis Grizzlies,Two 10-day contracts followed by signing for the rest of season
01/29/17,"Patterson, Lamar",,Atlanta Hawks,Two 10-day contracts followed by signing for the rest of season,2017-01-29,2016-17,"Patterson, Lamar",Atlanta Hawks,Two 10-day contracts followed by signing for the rest of season
01/28/17,"Ferrell, Yogi",,Dallas Mavericks,10-day contract followed by signing for the rest of season,2017-01-28,2016-17,"Ferrell, Yogi",Dallas Mavericks,10-day contract followed by signing for the rest of season
01/27/17,"Price, Ronnie",,Phoenix Suns,Two 10-day contracts followed by signing for the rest of season,2017-01-27,2016-17,"Price, Ronnie",Phoenix Suns,Two 10-day contracts followed by signing for the rest of season
01/26/17,"O'Bryant, Johnny",,Denver Nuggets,Two 10-day contracts (only 1st date is shown),2017-01-26,2016-17,"O'Bryant, Johnny",Denver Nuggets,Two 10-day contracts (only 1st date is shown)
01/23/17,"Anthony, Joel",,San Antonio Spurs,Two 10-day contracts followed by signing for the rest of season,2017-01-23,2016-17,"Anthony, Joel",San Antonio Spurs,Two 10-day contracts followed by signing for the rest of season
01/22/17,"Brown, Anthony",,Orlando Magic,10-day contract,2017-01-22,2016-17,"Brown, Anthony",Orlando Magic,10-day contract
01/18/17,"Neal, Gary",,Atlanta Hawks,10-day contract,2017-01-18,2016-17,"Neal, Gary",Atlanta Hawks,10-day contract
01/17/17,"White, Okaro",,Miami Heat,Two 10-day contracts followed by signing for the rest of season,2017-01-17,2016-17,"White, Okaro",Miami Heat,Two 10-day contracts followed by signing for the rest of season
01/15/17,"Jackson, Pierre",,Dallas Mavericks,Two 10-day contracts (only 1st date is shown),2017-01-15,2016-17,"Jackson, Pierre",Dallas Mavericks,Two 10-day contracts (only 1st date is shown)
01/15/17,"Jackson, Pierre",,Dallas Mavericks,Two 10-day contracts (only 1st date is shown),2017-01-15,2016-17,"Jackson, Pierre",Dallas Mavericks,Two 10-day contracts (only 1st date is shown)
01/10/17,"Randle, Chasson",,Philadelphia 76ers,Two 10-day contracts followed by signing for the rest of season,2017-01-10,2016-17,"Randle, Chasson",Philadelphia 76ers,Two 10-day contracts followed by signing for the rest of season
01/10/17,"Acy, Quincy",,Brooklyn Nets,Two 10-day contracts followed by signing for the rest of season,2017-01-10,2016-17,"Acy, Quincy",Brooklyn Nets,Two 10-day contracts followed by signing for the rest of season
01/08/17,"Gee, Alonzo",,Denver Nuggets,10-day contract,2017-01-08,2016-17,"Gee, Alonzo",Denver Nuggets,10-day contract
04/01/16,"Cotton, Bryce",,Memphis Grizzlies,10-day contract followed by signing for the rest of season,2016-04-01,2015-16,"Cotton, Bryce",Memphis Grizzlies,10-day contract followed by signing for the rest of season
03/30/16,"Ennis, James",,New Orleans Pelicans,10-day contract followed by signing for the rest of season,2016-03-30,2015-16,"Ennis, James",New Orleans Pelicans,10-day contract followed by signing for the rest of season
03/25/16,"Hamilton, Jordan",,New Orleans Pelicans,10-day contract followed by signing for the rest of season,2016-03-25,2015-16,"Hamilton, Jordan",New Orleans Pelicans,10-day contract followed by signing for the rest of season
03/21/16,"Farmar, Jordan",,Memphis Grizzlies,10-day contract followed by signing for the rest of season,2016-03-21,2015-16,"Farmar, Jordan",Memphis Grizzlies,10-day contract followed by signing for the rest of season
03/18/16,"Brown, Lorenzo",,Detroit Pistons,Two 10-day contracts followed by signing for the rest of season,2016-03-18,2015-16,"Brown, Lorenzo",Detroit Pistons,Two 10-day contracts followed by signing for the rest of season
03/17/16,"Sims, Henry",,Brooklyn Nets,Two 10-day contracts followed by signing for the rest of season,2016-03-17,2015-16,"Sims, Henry",Brooklyn Nets,Two 10-day contracts followed by signing for the rest of season
03/16/16,"Frazier, Tim",,New Orleans Pelicans,10-day contract followed by signing for the rest of season,2016-03-16,2015-16,"Frazier, Tim",New Orleans Pelicans,10-day contract followed by signing for the rest of season
03/16/16,"Cunningham, Jared",,Milwaukee Bucks,10-day contract,2016-03-16,2015-16,"Cunningham, Jared",Milwaukee Bucks,10-day contract
03/16/16,"Munford, Xavier",,Memphis Grizzlies,Two 10-day contracts followed by signing for the rest of season,2016-03-16,2015-16,"Munford, Xavier",Memphis Grizzlies,Two 10-day contracts followed by signing for the rest of season
03/12/16,"Stepheson, Alex",,Memphis Grizzlies,10-day contract,2016-03-12,2015-16,"Stepheson, Alex",Memphis Grizzlies,10-day contract
03/12/16,"McCallum, Ray",,Memphis Grizzlies,Two 10-day contracts (only 1st date is shown),2016-03-12,2015-16,"McCallum, Ray",Memphis Grizzlies,Two 10-day contracts (only 1st date is shown)
03/11/16,"Weber, Briante",,Memphis Grizzlies,10-day contract,2016-03-11,2015-16,"Weber, Briante",Memphis Grizzlies,10-day contract
03/09/16,"Johnson, Orlando",,New Orleans Pelicans,10-day contract,2016-03-09,2015-16,"Johnson, Orlando",New Orleans Pelicans,10-day contract
03/08/16,"Williams, Alan",,Phoenix Suns,10-day contract followed by signing for the rest of season,2016-03-08,2015-16,"Williams, Alan",Phoenix Suns,10-day contract followed by signing for the rest of season
03/07/16,"Clarke, Coty",,Boston Celtics,Two 10-day contracts (only 1st date is shown),2016-03-07,2015-16,"Clarke, Coty",Boston Celtics,Two 10-day contracts (only 1st date is shown)
03/04/16,"Wood, Christian",,Philadelphia 76ers,Two 10-day contracts followed by signing for the rest of season,2016-03-04,2015-16,"Wood, Christian",Philadelphia 76ers,Two 10-day contracts followed by signing for the rest of season
03/03/16,"Toupane, Axel",,Denver Nuggets,Two 10-day contracts followed by signing for the rest of season,2016-03-03,2015-16,"Toupane, Axel",Denver Nuggets,Two 10-day contracts followed by signing for the rest of season
03/02/16,"Smith, Greg",,Minnesota Timberwolves,Two 10-day contracts followed by signing for the rest of season,2016-03-02,2015-16,"Smith, Greg",Minnesota Timberwolves,Two 10-day contracts followed by signing for the rest of season
02/28/16,"Kilpatrick, Sean",,Brooklyn Nets,Two 10-day contracts followed by signing for the rest of season,2016-02-28,2015-16,"Kilpatrick, Sean",Brooklyn Nets,Two 10-day contracts followed by signing for the rest of season
02/28/16,"McRae, Jordan",,Cleveland Cavaliers,10-day contract followed by signing for the rest of season,2016-02-28,2015-16,"McRae, Jordan",Cleveland Cavaliers,10-day contract followed by signing for the rest of season
02/24/16,"Harper, Justin",,Detroit Pistons,Two 10-day contracts (only 1st date is shown),2016-02-24,2015-16,"Harper, Justin",Detroit Pistons,Two 10-day contracts (only 1st date is shown)
02/22/16,"Fredette, Jimmer",,New York Knicks,10-day contract,2016-02-22,2015-16,"Fredette, Jimmer",New York Knicks,10-day contract
02/20/16,"Gutierrez, Jorge",,Charlotte Hornets,10-day contract followed by signing for the rest of season,2016-02-20,2015-16,"Gutierrez, Jorge",Charlotte Hornets,10-day contract followed by signing for the rest of season
02/20/16,"Pressey, Phil",,Phoenix Suns,Two 10-day contracts (only 1st date is shown),2016-02-20,2015-16,"Pressey, Phil",Phoenix Suns,Two 10-day contracts (only 1st date is shown)
02/20/16,"Stepheson, Alex",,Los Angeles Clippers,Two 10-day contracts (only 1st date is shown),2016-02-20,2015-16,"Stepheson, Alex",Los Angeles Clippers,Two 10-day contracts (only 1st date is shown)
02/05/16,"Johnson, Orlando",,Phoenix Suns,10-day contract,2016-02-05,2015-16,"Johnson, Orlando",Phoenix Suns,10-day contract
01/29/16,"McRae, Jordan",,Phoenix Suns,Two 10-day contracts (only 1st date is shown),2016-01-29,2015-16,"McRae, Jordan",Phoenix Suns,Two 10-day contracts (only 1st date is shown)
01/29/16,"Antetokounmpo, Thanasis",,New York Knicks,10-day contract,2016-01-29,2015-16,"Antetokounmpo, Thanasis",New York Knicks,10-day contract
01/26/16,"Green, Erick",,Utah Jazz,Two 10-day contracts (only 1st date is shown),2016-01-26,2015-16,"Green, Erick",Utah Jazz,Two 10-day contracts (only 1st date is shown)
01/23/16,"Ayres, Jeff",,Los Angeles Clippers,Two 10-day contracts followed by signing for the rest of season,2016-01-23,2015-16,"Ayres, Jeff",Los Angeles Clippers,Two 10-day contracts followed by signing for the rest of season
01/21/16,"Dejean-Jones, Bryce",,New Orleans Pelicans,Two 10-day contracts followed by signing for the rest of season,2016-01-21,2015-16,"Dejean-Jones, Bryce",New Orleans Pelicans,Two 10-day contracts followed by signing for the rest of season
01/21/16,"Jefferson, Cory",,Phoenix Suns,10-day contract,2016-01-21,2015-16,"Jefferson, Cory",Phoenix Suns,10-day contract
01/21/16,"Hollins, Ryan",,Memphis Grizzlies,Two 10-day contracts followed by signing for the rest of season,2016-01-21,2015-16,"Hollins, Ryan",Memphis Grizzlies,Two 10-day contracts followed by signing for the rest of season
01/18/16,"Appling, Keith",,Orlando Magic,Two 10-day contracts (only 1st date is shown),2016-01-18,2015-16,"Appling, Keith",Orlando Magic,Two 10-day contracts (only 1st date is shown)
01/16/16,"O'Brien, J.J.",,Utah Jazz,10-day contract,2016-01-16,2015-16,"O'Brien, J.J.",Utah Jazz,10-day contract
01/12/16,"Kilpatrick, Sean",,Denver Nuggets,Two 10-day contracts (only 1st date is shown),2016-01-12,2015-16,"Kilpatrick, Sean",Denver Nuggets,Two 10-day contracts (only 1st date is shown)
01/08/16,"Williams, Elliot",,Memphis Grizzlies,10-day contract,2016-01-08,2015-16,"Williams, Elliot",Memphis Grizzlies,10-day contract
01/08/16,"Brown, Lorenzo",,Phoenix Suns,Two 10-day contracts (only 1st date is shown),2016-01-08,2015-16,"Brown, Lorenzo",Phoenix Suns,Two 10-day contracts (only 1st date is shown)
04/03/15,"Buycks, Dwight",,Los Angeles Lakers,10-day contract,2015-04-03,2014-15,"Buycks, Dwight",Los Angeles Lakers,10-day contract
04/02/15,"Bhullar, Sim",,Sacramento Kings,10-day contract,2015-04-02,2014-15,"Bhullar, Sim",Sacramento Kings,10-day contract
04/01/15,"McNeal, Jerel",,Phoenix Suns,10-day contract followed by signing for the rest of season,2015-04-01,2014-15,"McNeal, Jerel",Phoenix Suns,10-day contract followed by signing for the rest of season
03/29/15,"Hudson, Lester",,Los Angeles Clippers,10-day contract followed by signing for the rest of season,2015-03-29,2014-15,"Hudson, Lester",Los Angeles Clippers,10-day contract followed by signing for the rest of season
03/27/15,"Clark, Earl",,Brooklyn Nets,10-day contract followed by signing for the rest of season,2015-03-27,2014-15,"Clark, Earl",Brooklyn Nets,10-day contract followed by signing for the rest of season
03/27/15,"Bynum, Will",,Washington Wizards,10-day contract followed by signing for the rest of season,2015-03-27,2014-15,"Bynum, Will",Washington Wizards,10-day contract followed by signing for the rest of season
03/23/15,"Wear, David",,Sacramento Kings,10-day contract,2015-03-23,2014-15,"Wear, David",Sacramento Kings,10-day contract
03/21/15,"Price, A.J.",,Phoenix Suns,10-day contract,2015-03-21,2014-15,"Price, A.J.",Phoenix Suns,10-day contract
03/19/15,"Ledo, Ricky",,New York Knicks,Two 10-day contracts followed by signing for the rest of season,2015-03-19,2014-15,"Ledo, Ricky",New York Knicks,Two 10-day contracts followed by signing for the rest of season
03/19/15,"Kilpatrick, Sean",,Minnesota Timberwolves,10-day contract,2015-03-19,2014-15,"Kilpatrick, Sean",Minnesota Timberwolves,10-day contract
03/15/15,"Daye, Austin",,Atlanta Hawks,Two 10-day contracts followed by signing for the rest of season,2015-03-15,2014-15,"Daye, Austin",Atlanta Hawks,Two 10-day contracts followed by signing for the rest of season
03/12/15,"Murry, Toure'",,Washington Wizards,Two 10-day contracts (only 1st date is shown),2015-03-12,2014-15,"Murry, Toure'",Washington Wizards,Two 10-day contracts (only 1st date is shown)
03/11/15,"Curry, Seth",,Phoenix Suns,10-day contract,2015-03-11,2014-15,"Curry, Seth",Phoenix Suns,10-day contract
03/10/15,"Brown, Jabari",,Los Angeles Lakers,Two 10-day contracts followed by signing for the rest of season,2015-03-10,2014-15,"Brown, Jabari",Los Angeles Lakers,Two 10-day contracts followed by signing for the rest of season
03/07/15,"Robinson, Nate",,Los Angeles Clippers,Two 10-day contracts (only 1st date is shown),2015-03-07,2014-15,"Robinson, Nate",Los Angeles Clippers,Two 10-day contracts (only 1st date is shown)
03/06/15,"Benimon, Jerrelle",,Utah Jazz,10-day contract,2015-03-06,2014-15,"Benimon, Jerrelle",Utah Jazz,10-day contract
03/06/15,"Johnson, Christapher",,Milwaukee Bucks,Two 10-day contracts (only 1st date is shown),2015-03-06,2014-15,"Johnson, Christapher",Milwaukee Bucks,Two 10-day contracts (only 1st date is shown)
03/05/15,"Eddie, Jarell",,Atlanta Hawks,10-day contract,2015-03-05,2014-15,"Eddie, Jarell",Atlanta Hawks,10-day contract
03/04/15,"Williams, Elliot",,New Orleans Pelicans,Two 10-day contracts (only 1st date is shown),2015-03-04,2014-15,"Williams, Elliot",New Orleans Pelicans,Two 10-day contracts (only 1st date is shown)
02/26/15,"Beasley, Michael",,Miami Heat,Two 10-day contracts followed by signing for the rest of season,2015-02-26,2014-15,"Beasley, Michael",Miami Heat,Two 10-day contracts followed by signing for the rest of season
02/24/15,"Cooley, Jack",,Utah Jazz,Two 10-day contracts followed by signing for the rest of season,2015-02-24,2014-15,"Cooley, Jack",Utah Jazz,Two 10-day contracts followed by signing for the rest of season
02/24/15,"Cotton, Bryce",,Utah Jazz,Two 10-day contracts followed by signing for the rest of season,2015-02-24,2014-15,"Cotton, Bryce",Utah Jazz,Two 10-day contracts followed by signing for the rest of season
02/24/15,"Hamilton, Jordan",,Los Angeles Clippers,Two 10-day contracts followed by signing for the rest of season,2015-02-24,2014-15,"Hamilton, Jordan",Los Angeles Clippers,Two 10-day contracts followed by signing for the rest of season
02/21/15,"Miller, Quincy",,Detroit Pistons,Two 10-day contracts followed by signing for the rest of season,2015-02-21,2014-15,"Miller, Quincy",Detroit Pistons,Two 10-day contracts followed by signing for the rest of season
02/21/15,"Barron, Earl",,Phoenix Suns,Two 10-day contracts followed by signing for the rest of season,2015-02-21,2014-15,"Barron, Earl",Phoenix Suns,Two 10-day contracts followed by signing for the rest of season
02/21/15,"Walker, Henry",,Miami Heat,Two 10-day contracts followed by signing for the rest of season,2015-02-21,2014-15,"Walker, Henry",Miami Heat,Two 10-day contracts followed by signing for the rest of season
02/20/15,"Stockton, David",,Sacramento Kings,10-day contract followed by signing for the rest of season,2015-02-20,2014-15,"Stockton, David",Sacramento Kings,10-day contract followed by signing for the rest of season
02/11/15,"James, Bernard",,Dallas Mavericks,Two 10-day contracts followed by signing for the rest of season,2015-02-11,2014-15,"James, Bernard",Dallas Mavericks,Two 10-day contracts followed by signing for the rest of season
02/05/15,"Frazier, Tim",,Philadelphia 76ers,Two 10-day contracts (only 1st date is shown),2015-02-05,2014-15,"Frazier, Tim",Philadelphia 76ers,Two 10-day contracts (only 1st date is shown)
02/04/15,"Williams, Elliot",,Charlotte Hornets,10-day contract,2015-02-04,2014-15,"Williams, Elliot",Charlotte Hornets,10-day contract
02/04/15,"Douglas, Toney",,New Orleans Pelicans,Two 10-day contracts followed by signing for the rest of season,2015-02-04,2014-15,"Douglas, Toney",New Orleans Pelicans,Two 10-day contracts followed by signing for the rest of season
02/02/15,"Green, JaMychal",,Memphis Grizzlies,Two 10-day contracts followed by signing for the rest of season,2015-02-02,2014-15,"Green, JaMychal",Memphis Grizzlies,Two 10-day contracts followed by signing for the rest of season
02/02/15,"Lucas III, John",,Detroit Pistons,Two 10-day contracts followed by signing for the rest of season,2015-02-02,2014-15,"Lucas III, John",Detroit Pistons,Two 10-day contracts followed by signing for the rest of season
01/28/15,"Gutierrez, Jorge",,Milwaukee Bucks,Two 10-day contracts followed by signing for the rest of season,2015-01-28,2014-15,"Gutierrez, Jorge",Milwaukee Bucks,Two 10-day contracts followed by signing for the rest of season
01/28/15,"Johnson, Christapher",,Utah Jazz,10-day contract followed by signing for the rest of season,2015-01-28,2014-15,"Johnson, Christapher",Utah Jazz,10-day contract followed by signing for the rest of season
01/28/15,"Williams, Reggie",,San Antonio Spurs,Two 10-day contracts followed by signing for the rest of season,2015-01-28,2014-15,"Williams, Reggie",San Antonio Spurs,Two 10-day contracts followed by signing for the rest of season
01/27/15,"Brown, Lorenzo",,Minnesota Timberwolves,Two 10-day contracts followed by signing for the rest of season,2015-01-27,2014-15,"Brown, Lorenzo",Minnesota Timberwolves,Two 10-day contracts followed by signing for the rest of season
01/23/15,"Dawkins, Andre",,Boston Celtics,Two 10-day contracts (only 1st date is shown),2015-01-23,2014-15,"Dawkins, Andre",Boston Celtics,Two 10-day contracts (only 1st date is shown)
01/22/15,"Thomas, Tyrus",,Memphis Grizzlies,10-day contract,2015-01-22,2014-15,"Thomas, Tyrus",Memphis Grizzlies,10-day contract
01/19/15,"McAdoo, James Michael",,Golden State Warriors,Two 10-day contracts followed by signing for the rest of season,2015-01-19,2014-15,"McAdoo, James Michael",Golden State Warriors,Two 10-day contracts followed by signing for the rest of season
01/18/15,"Green, JaMychal",,San Antonio Spurs,10-day contract,2015-01-18,2014-15,"Green, JaMychal",San Antonio Spurs,10-day contract
01/17/15,"Miller, Quincy",,Sacramento Kings,Two 10-day contracts (only 1st date is shown),2015-01-17,2014-15,"Miller, Quincy",Sacramento Kings,Two 10-day contracts (only 1st date is shown)
01/16/15,"Drew II, Larry",,Philadelphia 76ers,Two 10-day contracts (only 1st date is shown),2015-01-16,2014-15,"Drew II, Larry",Philadelphia 76ers,Two 10-day contracts (only 1st date is shown)
01/14/15,"Wolters, Nate",,New Orleans Pelicans,Two 10-day contracts (only 1st date is shown),2015-01-14,2014-15,"Wolters, Nate",New Orleans Pelicans,Two 10-day contracts (only 1st date is shown)
01/14/15,"Jones, Dahntay",,Los Angeles Clippers,Two 10-day contracts followed by signing for the rest of season,2015-01-14,2014-15,"Jones, Dahntay",Los Angeles Clippers,Two 10-day contracts followed by signing for the rest of season
01/12/15,"Johnson, Tyler",,Miami Heat,Two 10-day contracts followed by signing for the rest of season,2015-01-12,2014-15,"Johnson, Tyler",Miami Heat,Two 10-day contracts followed by signing for the rest of season
01/10/15,"Thomas, Lance",,New York Knicks,Two 10-day contracts followed by signing for the rest of season,2015-01-10,2014-15,"Thomas, Lance",New York Knicks,Two 10-day contracts followed by signing for the rest of season
01/10/15,"Amundson, Louis",,New York Knicks,Two 10-day contracts followed by signing for the rest of season,2015-01-10,2014-15,"Amundson, Louis",New York Knicks,Two 10-day contracts followed by signing for the rest of season
01/09/15,"Martin, Kenyon",,Milwaukee Bucks,Two 10-day contracts followed by signing for the rest of season,2015-01-09,2014-15,"Martin, Kenyon",Milwaukee Bucks,Two 10-day contracts followed by signing for the rest of season
01/08/15,"Raduljica, Miroslav",,Minnesota Timberwolves,Two 10-day contracts (only 1st date is shown),2015-01-08,2014-15,"Raduljica, Miroslav",Minnesota Timberwolves,Two 10-day contracts (only 1st date is shown)
01/07/15,"Williams, Elliot",,Utah Jazz,Two 10-day contracts (only 1st date is shown),2015-01-07,2014-15,"Williams, Elliot",Utah Jazz,Two 10-day contracts (only 1st date is shown)
01/07/15,"Galloway, Langston",,New York Knicks,Two 10-day contracts followed by signing for the rest of season,2015-01-07,2014-15,"Galloway, Langston",New York Knicks,Two 10-day contracts followed by signing for the rest of season
01/05/15,"Millsap, Elijah",,Utah Jazz,Two 10-day contracts followed by signing for the rest of season,2015-01-05,2014-15,"Millsap, Elijah",Utah Jazz,Two 10-day contracts followed by signing for the rest of season
04/07/14,"Thomas, Adonis",,Philadelphia 76ers,10-day contract,2014-04-07,2013-14,"Thomas, Adonis",Philadelphia 76ers,10-day contract
04/03/14,"James, Damion",,San Antonio Spurs,10-day contract followed by signing for the rest of season,2014-04-03,2013-14,"James, Damion",San Antonio Spurs,10-day contract followed by signing for the rest of season
03/31/14,"Cunningham, Jared",,Sacramento Kings,Two 10-day contracts followed by signing for the rest of season,2014-03-31,2013-14,"Cunningham, Jared",Sacramento Kings,Two 10-day contracts followed by signing for the rest of season
03/30/14,"Armstrong, Hilton",,Golden State Warriors,10-day contract,2014-03-30,2013-14,"Armstrong, Hilton",Golden State Warriors,10-day contract
03/26/14,"Stephens, D.J.",,Milwaukee Bucks,10-day contract,2014-03-26,2013-14,"Stephens, D.J.",Milwaukee Bucks,10-day contract
03/24/14,"Ware, Casper",,Philadelphia 76ers,Two 10-day contracts followed by signing for the rest of season,2014-03-24,2013-14,"Ware, Casper",Philadelphia 76ers,Two 10-day contracts followed by signing for the rest of season
03/21/14,"White, DJ",,Charlotte Bobcats,Two 10-day contracts followed by signing for the rest of season,2014-03-21,2013-14,"White, DJ",Charlotte Bobcats,Two 10-day contracts followed by signing for the rest of season
03/21/14,"Curry, Seth",,Cleveland Cavaliers,10-day contract,2014-03-21,2013-14,"Curry, Seth",Cleveland Cavaliers,10-day contract
03/17/14,"Nunnally, James",,Philadelphia 76ers,Two 10-day contracts (only 1st date is shown),2014-03-17,2013-14,"Nunnally, James",Philadelphia 76ers,Two 10-day contracts (only 1st date is shown)
03/16/14,"Shakur, Mustafa",,Oklahoma City Thunder,10-day contract,2014-03-16,2013-14,"Shakur, Mustafa",Oklahoma City Thunder,10-day contract
03/14/14,"Wright, Chris",,Milwaukee Bucks,Two 10-day contracts followed by signing for the rest of season,2014-03-14,2013-14,"Wright, Chris",Milwaukee Bucks,Two 10-day contracts followed by signing for the rest of season
03/14/14,"Johnson-Odom, Darius",,Philadelphia 76ers,10-day contract,2014-03-14,2013-14,"Johnson-Odom, Darius",Philadelphia 76ers,10-day contract
03/12/14,"Edwards, Shane",,Cleveland Cavaliers,10-day contract,2014-03-12,2013-14,"Edwards, Shane",Cleveland Cavaliers,10-day contract
03/06/14,"Gutierrez, Jorge",,Brooklyn Nets,Two 10-day contracts followed by signing for the rest of season,2014-03-06,2013-14,"Gutierrez, Jorge",Brooklyn Nets,Two 10-day contracts followed by signing for the rest of season
03/06/14,"Williams, Reggie",,Oklahoma City Thunder,Two 10-day contracts (only 1st date is shown),2014-03-06,2013-14,"Williams, Reggie",Oklahoma City Thunder,Two 10-day contracts (only 1st date is shown)
03/06/14,"White, Royce",,Sacramento Kings,Two 10-day contracts (only 1st date is shown),2014-03-06,2013-14,"White, Royce",Sacramento Kings,Two 10-day contracts (only 1st date is shown)
03/04/14,"Hamilton, Justin",,Charlotte Bobcats,10-day contract,2014-03-04,2013-14,"Hamilton, Justin",Charlotte Bobcats,10-day contract
03/04/14,"Mitchell, Tony",,Milwaukee Bucks,10-day contract,2014-03-04,2013-14,"Mitchell, Tony",Milwaukee Bucks,10-day contract
03/01/14,"Varnado, Jarvis",,Philadelphia 76ers,10-day contract followed by signing for the rest of season,2014-03-01,2013-14,"Varnado, Jarvis",Philadelphia 76ers,10-day contract followed by signing for the rest of season
02/28/14,"Babb, Chris",,Boston Celtics,Two 10-day contracts followed by signing for the rest of season,2014-02-28,2013-14,"Babb, Chris",Boston Celtics,Two 10-day contracts followed by signing for the rest of season
02/27/14,"Clark, Earl",,New York Knicks,Two 10-day contracts (only 1st date is shown),2014-02-27,2013-14,"Clark, Earl",New York Knicks,Two 10-day contracts (only 1st date is shown)
02/27/14,"Brown, Shannon",,New York Knicks,Two 10-day contracts followed by signing for the rest of season,2014-02-27,2013-14,"Brown, Shannon",New York Knicks,Two 10-day contracts followed by signing for the rest of season
02/26/14,"Gooden, Drew",,Washington Wizards,Two 10-day contracts followed by signing for the rest of season,2014-02-26,2013-14,"Gooden, Drew",Washington Wizards,Two 10-day contracts followed by signing for the rest of season
02/26/14,"Johnson, Orlando",,Sacramento Kings,Two 10-day contracts (only 1st date is shown),2014-02-26,2013-14,"Johnson, Orlando",Sacramento Kings,Two 10-day contracts (only 1st date is shown)
02/25/14,"Thomas, Adonis",,Orlando Magic,Two 10-day contracts (only 1st date is shown),2014-02-25,2013-14,"Thomas, Adonis",Orlando Magic,Two 10-day contracts (only 1st date is shown)
02/25/14,"Dedmon, Dewayne",,Orlando Magic,Two 10-day contracts followed by signing for the rest of season,2014-02-25,2013-14,"Dedmon, Dewayne",Orlando Magic,Two 10-day contracts followed by signing for the rest of season
